18:18:29.924880 IP 122.140.223.124.26403 > 42.51.144.147.12378: Flags [P.], seq 2113859425:2113859456, ack 1528205002, win 16695, length 31
18:18:29.924882 IP 123.138.114.151.50441 > 42.51.155.43.443: Flags [.], ack 3142861448, win 63810, options [nop,nop,sack 1 {4294732484:4294732979}], length 0
18:18:29.924883 IP 120.34.79.51.1807 > 42.51.160.207.12378: Flags [.], ack 765148754, win 260, length 0
18:18:29.924884 IP 124.231.207.120.7078 > 42.51.136.233.45408: UDP, length 32
18:18:29.924886 IP 126.250.199.216.7078 > 42.51.136.233.61558: UDP, length 32
18:18:29.924887 IP 118.122.116.30.25420 > 42.51.136.243.31692: UDP, length 32
18:18:29.924931 IP 121.20.188.151.5864 > 42.51.144.119.12378: Flags [P.], seq 3095949989:3095950049, ack 3171191446, win 16393, length 60
18:18:29.924932 IP 125.39.136.83.3117 > 42.51.140.138.26406: Flags [P.], seq 1005611795:1005611803, ack 3530980766, win 102, options [nop,nop,TS val 1892727149 ecr 814731533], length 8
18:18:29.924933 IP 125.39.136.12.3134 > 42.51.140.117.57691: Flags [P.], seq 229478445:229478787, ack 1992422695, win 94, options [nop,nop,TS val 1546488487 ecr 814731587], length 342
18:18:29.924935 IP 125.39.136.83.3117 > 42.51.140.87.26403: Flags [P.], seq 521911374:521911416, ack 2802705613, win 102, options [nop,nop,TS val 1892727149 ecr 814731533], length 42
18:18:29.924937 IP 39.80.76.9.51292 > 42.51.163.250.38826: UDP, length 108
18:18:29.924938 IP 125.70.16.57.6466 > 42.51.136.235.26414: UDP, length 32
18:18:29.924940 IP 122.244.49.185.25186 > 42.51.136.242.40986: UDP, length 32
18:18:29.924941 IP 115.236.148.151.10124 > 42.51.144.52.30369: Flags [P.], seq 2188755057:2188755293, ack 2070844147, win 3880, options [nop,nop,TS val 3822635677 ecr 795749684], length 236
18:18:29.924942 IP 122.228.196.172.21013 > 42.51.160.122.55960: Flags [P.], seq 3626414050:3626414090, ack 2776844654, win 254, length 40
18:18:29.924944 IP 112.90.78.176.80 > 42.51.154.142.3509: Flags [P.], seq 3328178897:3328179080, ack 1172736073, win 6432, length 183
18:18:29.924948 IP 112.90.78.176.80 > 42.51.154.142.3509: Flags [P.], seq 183:233, ack 1, win 6432, length 50
18:18:29.924950 IP 112.90.78.176.80 > 42.51.154.142.3509: Flags [F.], seq 233, ack 1, win 6432, length 0
18:18:29.924953 IP 125.70.16.57.6986 > 42.51.136.235.26460: UDP, length 32
18:18:29.924954 IP 125.39.240.42.12021 > 42.51.160.110.55652: Flags [P.], seq 2535759556:2535759644, ack 1199085817, win 5590, options [nop,nop,TS val 2533763228 ecr 796631689], length 88
18:18:29.924956 IP 123.53.2.239.10930 > 42.51.136.238.64782: UDP, length 32
18:18:29.924959 IP 125.39.240.115.80 > 42.51.140.241.49563: Flags [.], ack 531725782, win 1521, options [nop,nop,TS val 2611223584 ecr 814731586], length 0
18:18:29.924963 IP 101.226.76.208.10092 > 42.51.140.143.30254: Flags [P.], seq 1466726883:1466726959, ack 249000360, win 573, options [nop,nop,TS val 2708780238 ecr 814731560], length 76
18:18:29.924964 IP 220.189.225.186.3389 > 42.51.154.201.54286: Flags [P.], seq 3706936177:3706937637, ack 2341237105, win 255, length 1460
18:18:29.924966 IP 183.57.48.27.80 > 42.51.160.58.29681: Flags [.], ack 2142880122, win 1525, options [nop,nop,TS val 4124922855 ecr 796631671], length 0
18:18:29.924969 IP 183.57.48.27.80 > 42.51.160.58.29681: Flags [.], ack 1429, win 1525, options [nop,nop,TS val 4124922855 ecr 796631671], length 0
18:18:29.924972 IP 121.14.64.224.3121 > 42.51.140.49.43158: Flags [.], ack 3145928437, win 74, options [nop,nop,TS val 2066605869 ecr 814731529], length 0
18:18:29.924974 IP 126.205.148.101.7078 > 42.51.136.238.61992: UDP, length 32
18:18:29.924975 IP 125.89.199.43.8832 > 42.51.136.235.26510: UDP, length 32
18:18:29.924976 IP 182.140.168.19.5132 > 42.51.160.104.41225: UDP, length 640
18:18:29.924980 IP 1.57.188.182.49200 > 42.51.164.210.12378: Flags [.], ack 2233582846, win 15834, length 0
18:18:29.925375 IP 115.195.96.243.8684 > 42.51.140.228.12378: Flags [.], ack 2301064407, win 16457, length 0
18:18:29.925398 IP 125.70.16.40.7006 > 42.51.136.243.20458:  rx type 127 (32)
18:18:29.925413 IP 222.88.244.22.7798 > 42.51.140.3.12378: Flags [.], ack 790555211, win 16410, length 0
18:18:29.925480 IP 124.160.175.151.10124 > 42.51.140.102.49444: Flags [P.], seq 4020313975:4020314439, ack 1784949748, win 3256, options [nop,nop,TS val 3822635676 ecr 814731575], length 464
18:18:29.925482 IP 119.6.84.219.8464 > 42.51.136.243.24200: UDP, length 32
18:18:29.925484 IP 125.39.136.18.3115 > 42.51.140.28.51695: Flags [P.], seq 1444536044:1444536089, ack 922199829, win 101, options [nop,nop,TS val 169142080 ecr 814731584], length 45
18:18:29.925485 IP 222.88.244.22.6952 > 42.51.140.4.12378: Flags [.], ack 2020664177, win 16406, length 0
18:18:29.925487 IP 125.39.136.18.3115 > 42.51.144.72.51727: Flags [P.], seq 1826475662:1826475852, ack 1804516428, win 106, options [nop,nop,TS val 169142080 ecr 795749690], length 190
18:18:29.925488 IP 121.14.64.191.3111 > 42.51.160.240.8568: Flags [P.], seq 2245692916:2245692924, ack 261697790, win 103, options [nop,nop,TS val 1430146412 ecr 796631672], length 8
18:18:29.925491 IP 183.12.160.25.7728 > 42.51.131.138.5555: Flags [P.], seq 2302221699:2302221703, ack 2178179801, win 32764, length 4
18:18:29.925502 IP 1.183.179.140.55283 > 42.51.160.160.12378: Flags [.], ack 2679689211, win 16218, length 0
18:18:29.925510 IP 121.14.64.208.3120 > 42.51.160.204.64636: Flags [P.], seq 3878190912:3878190920, ack 4291888427, win 104, options [nop,nop,TS val 1430127880 ecr 796631648], length 8
18:18:29.925545 IP 1.206.27.84.7076 > 42.51.136.233.53936: UDP, length 32
18:18:29.925553 IP 113.5.99.3.33611 > 42.51.136.242.39428: UDP, length 32
18:18:29.925566 IP 113.239.179.164.50926 > 42.51.163.5.12378: Flags [.], ack 2246761389, win 16685, length 0
18:18:29.925630 IP 116.116.103.6.13453 > 42.51.132.98.8100: Flags [.], ack 3229945521, win 532, length 0
18:18:29.925633 IP 42.230.159.163.12710 > 42.51.136.242.41778: UDP, length 32
18:18:29.925634 IP 182.204.255.216.64924 > 42.51.160.195.12378: Flags [P.], seq 2990634441:2990634464, ack 2967750908, win 16186, length 23
18:18:29.925637 IP 61.135.169.121.443 > 42.51.156.39.32785: Flags [.], seq 553346557:553352317, ack 2289176580, win 210, length 5760
18:18:29.925679 IP 182.121.235.45.59414 > 42.51.140.146.45928: UDP, length 24
18:18:29.925680 IP 36.16.1.207.51995 > 42.51.136.238.43754: UDP, length 32
18:18:29.925681 IP 116.231.164.55.7076 > 42.51.136.233.42812: UDP, length 32
18:18:29.925682 IP 223.252.227.85.3724 > 42.51.163.169.26392: Flags [P.], seq 3742997842:3742998005, ack 1307680999, win 4570, options [nop,nop,TS val 2663830796 ecr 796044629], length 163
18:18:29.925684 IP 182.133.164.42.1337 > 42.51.132.206.8001: Flags [.], ack 2082074609, win 63840, length 0
18:18:29.925685 IP 115.148.124.250.59558 > 42.51.144.199.12378: Flags [P.], seq 1716345477:1716345489, ack 2488694, win 16248, length 12
18:18:29.925689 IP 220.163.210.29.23719 > 42.51.155.3.80: Flags [.], ack 1678190281, win 16685, options [nop,nop,sack 1 {4261:11361}], length 0
18:18:29.925730 IP 125.70.16.53.7340 > 42.51.136.234.27890: UDP, length 32
18:18:29.925731 IP 125.70.16.53.5386 > 42.51.136.234.19000: UDP, length 32
18:18:29.925732 IP 113.0.6.122.2548 > 42.51.136.233.37098: UDP, length 32
18:18:29.925733 IP 112.90.78.176.80 > 42.51.156.89.2945: Flags [P.], seq 3310866454:3310866653, ack 2895505153, win 6432, length 199
18:18:29.925736 IP 112.90.78.176.80 > 42.51.156.89.2945: Flags [P.], seq 199:626, ack 1, win 6432, length 427
18:18:29.925740 IP 115.236.148.151.10094 > 42.51.160.118.3785: Flags [P.], seq 2227245815:2227245891, ack 3790055080, win 2372, options [nop,nop,TS val 3822637021 ecr 796630873], length 76
18:18:29.925742 IP 103.240.124.11.2758 > 42.51.136.242.54642: UDP, length 32
18:18:29.925829 IP 112.90.78.176.80 > 42.51.156.89.2945: Flags [F.], seq 626, ack 1, win 6432, length 0
18:18:29.925832 IP 42.228.222.108.51457 > 42.51.140.47.12378: Flags [P.], seq 332170142:332170187, ack 1778866368, win 16260, length 45
18:18:29.925834 IP 202.97.130.168.49889 > 42.51.136.233.47262: UDP, length 32
18:18:29.925835 IP 112.80.255.58.80 > 42.51.254.9.61365: Flags [.], ack 3322219557, win 9754, options [nop,nop,sack 1 {537:5361}], length 0
18:18:29.925837 IP 125.70.16.40.7068 > 42.51.136.243.30288: UDP, length 32
18:18:29.925839 IP 101.226.100.103.1239 > 42.51.160.213.10701: Flags [P.], seq 4191115110:4191115182, ack 1665761731, win 64817, options [nop,nop,TS val 141141926 ecr 796631673], length 72
18:18:29.925840 IP 121.224.138.29.7078 > 42.51.136.238.45216: UDP, length 32
18:18:29.925852 IP 122.96.31.35.9966 > 42.51.161.55.8049: Flags [P.], seq 1066266588:1066266628, ack 3918806870, win 16462, length 40
18:18:29.925857 IP 61.164.144.85.39028 > 42.51.132.206.8001: Flags [.], ack 3549462408, win 65146, length 0
18:18:29.925879 IP 221.237.156.58.6712 > 42.51.136.235.29036: UDP, length 32
18:18:29.925882 IP 119.147.154.229.5102 > 42.51.144.142.57539: UDP, length 76
18:18:29.925888 IP 119.147.207.169.10012 > 42.51.160.124.42866: Flags [S.], seq 2562281470, ack 1577363336, win 5792, options [mss 1460,sackOK,TS val 3834187342 ecr 796631684,nop,wscale 2], length 0
18:18:29.925898 IP 180.162.33.238.1100 > 42.51.136.233.38776: UDP, length 32
18:18:29.925906 IP 220.189.225.186.3389 > 42.51.154.201.54286: Flags [P.], seq 7300:7615, ack 1, win 255, length 315
18:18:29.925913 IP 221.228.202.64.32885 > 42.51.132.250.8077: Flags [.], ack 3655484813, win 287, length 0
18:18:29.925929 IP 144.0.122.106.11486 > 42.51.136.242.38996: UDP, length 32
18:18:29.925934 IP 124.160.175.151.10113 > 42.51.163.210.26394: Flags [P.], seq 204737969:204738029, ack 3054176021, win 3174, options [nop,nop,TS val 3822636377 ecr 796044912], length 60
18:18:29.925937 IP 1.56.184.55.26244 > 42.51.136.242.60914: UDP, length 32
18:18:29.925940 IP 140.207.179.149.10018 > 42.51.164.88.51779: Flags [P.], seq 262737090:262737157, ack 2683383605, win 758, options [nop,nop,TS val 1386649551 ecr 795814558], length 67
18:18:29.925944 IP 115.236.148.151.10117 > 42.51.144.50.14801: Flags [P.], seq 1080349449:1080349525, ack 157635448, win 3084, options [nop,nop,TS val 3822635525 ecr 795749496], length 76
18:18:29.925949 IP 220.248.194.75.8418 > 42.51.136.235.23932: UDP, length 32
18:18:29.925955 IP 125.39.136.83.3117 > 42.51.143.100.26382: Flags [P.], seq 678206441:678206449, ack 868319756, win 102, options [nop,nop,TS val 1892727149 ecr 814724272], length 8
18:18:29.925964 IP 58.58.183.63.48733 > 42.51.136.233.52830: UDP, length 32
18:18:29.925971 IP 120.55.73.86.36803 > 42.51.144.142.39190: Flags [P.], seq 651420617:651420651, ack 2926980800, win 64294, options [nop,nop,TS val 3871350 ecr 795749471], length 34
18:18:29.925978 IP 112.80.255.58.80 > 42.51.254.9.61365: Flags [.], ack 1, win 9754, options [nop,nop,sack 1 {537:5897}], length 0
18:18:29.925988 IP 112.90.78.176.80 > 42.51.155.141.2321: Flags [.], ack 848688780, win 6432, length 0
18:18:29.925991 IP 120.33.249.107.54915 > 42.51.140.103.12378: Flags [.], ack 2467270220, win 46720, length 0
18:18:29.925992 IP 119.127.218.112.52126 > 42.51.140.204.12378: Flags [.], ack 2940006588, win 65535, length 0
18:18:29.925994 IP 139.213.57.68.53282 > 42.51.144.33.12378: Flags [.], ack 3552497662, win 16392, length 0
18:18:29.925998 IP 125.39.136.83.3117 > 42.51.140.248.37221: Flags [P.], seq 3895482493:3895482501, ack 2998927288, win 102, options [nop,nop,TS val 1892727149 ecr 814731573], length 8
18:18:29.926012 IP 115.236.141.227.5104 > 42.51.134.161.38651: UDP, length 40
18:18:29.926019 IP 183.131.104.201.13231 > 42.51.139.171.55702: UDP, length 32
18:18:29.926020 IP 183.69.196.141.21538 > 42.51.163.143.12378: Flags [.], ack 2483916134, win 16385, length 0
18:18:29.926028 IP 14.17.23.149.5111 > 42.51.144.203.50333: UDP, length 81
18:18:29.926042 IP 116.10.242.174.2721 > 42.51.131.106.5555: Flags [.], ack 1287388096, win 32741, length 0
18:18:29.926049 IP 84.192.184.30.7078 > 42.51.136.242.62108: UDP, length 32
18:18:30.789646 IP 221.228.202.64.54599 > 42.51.132.99.8157: Flags [.], ack 2051163019, win 473, length 0
18:18:30.789648 IP 61.163.187.39.7076 > 42.51.136.233.47850: UDP, length 32
18:18:30.789650 IP 118.122.116.30.18914 > 42.51.136.235.29240: UDP, length 32
18:18:30.789652 IP 112.242.12.247.27692 > 42.51.140.65.12378: Flags [.], ack 4266194604, win 16650, length 0
18:18:30.789654 IP 125.39.136.100.3118 > 42.51.160.56.51850: Flags [P.], seq 4109192839:4109192877, ack 3344194136, win 63, options [nop,nop,TS val 1618147022 ecr 796632520], length 38
18:18:30.789657 IP 111.165.212.142.7076 > 42.51.136.238.56250: UDP, length 32
18:18:30.789659 IP 112.90.78.176.80 > 42.51.156.89.3057: Flags [.], ack 2854596833, win 6432, length 0
18:18:30.789664 IP 140.206.160.158.12004 > 42.51.163.78.50745: Flags [P.], seq 862126604:862126664, ack 3937824521, win 425, options [nop,nop,TS val 3822330661 ecr 796045737], length 60
18:18:30.789665 IP 221.10.51.117.7836 > 42.51.136.243.28770: UDP, length 32
18:18:30.789667 IP 182.121.235.45.59181 > 42.51.164.33.37646: UDP, length 24
18:18:30.789669 IP 115.63.183.183.53360 > 42.51.134.148.40516: UDP, length 24
18:18:30.789670 IP 27.28.28.20.27192 > 42.51.132.158.8255: Flags [P.], seq 1419765876:1419765888, ack 1724192007, win 16275, length 12
18:18:30.789672 IP 221.228.202.64.23864 > 42.51.132.99.8151: Flags [.], ack 3798329459, win 551, length 0
18:18:30.789674 IP 121.14.64.221.3114 > 42.51.160.99.16823: Flags [P.], seq 2953449168:2953449176, ack 1949925754, win 63, options [nop,nop,TS val 1430232875 ecr 796632521], length 8
18:18:30.789676 IP 111.195.66.95.7076 > 42.51.136.242.63104: UDP, length 32
18:18:30.789677 IP 223.73.70.136.9982 > 42.51.136.242.58322: UDP, length 32
18:18:30.789679 IP 115.236.148.151.10136 > 42.51.163.38.14928: Flags [P.], seq 2231499713:2231499897, ack 379231014, win 842, options [nop,nop,TS val 3818335929 ecr 796045790], length 184
18:18:30.789681 IP 221.228.202.64.19380 > 42.51.132.163.8001: Flags [.], ack 1380371068, win 2989, length 0
18:18:30.789683 IP 124.160.175.151.10129 > 42.51.134.215.22920: Flags [P.], seq 2271043839:2271044002, ack 408316456, win 43, options [nop,nop,TS val 2161295626 ecr 814755930], length 163
18:18:30.789685 IP 60.173.129.221.31032 > 42.51.136.233.52416: UDP, length 32
18:18:30.789687 IP 221.10.51.117.5158 > 42.51.136.235.17252: UDP, length 32
18:18:30.789689 IP 221.237.156.58.6320 > 42.51.136.234.30330: UDP, length 32
18:18:30.789691 IP 210.14.153.117.9024 > 42.51.140.86.8678: Flags [P.], seq 1409584854:1409584880, ack 1620772663, win 501, options [nop,nop,TS val 1421283805 ecr 814730894], length 26
18:18:30.789693 IP 183.165.207.135.1828 > 42.51.131.189.5555: Flags [.], ack 592259566, win 32739, length 0
18:18:30.789695 IP 112.239.8.92.23995 > 42.51.160.149.12378: Flags [.], ack 1033738904, win 16444, length 0
18:18:30.789697 IP 27.150.99.98.12139 > 42.51.156.196.63508: Flags [.], ack 1783215585, win 65535, length 0
18:18:30.789698 IP 125.39.136.83.3117 > 42.51.140.161.26463: Flags [P.], seq 846289464:846289472, ack 3158532440, win 102, options [nop,nop,TS val 1892728014 ecr 814732448], length 8
18:18:30.789700 IP 221.10.51.117.5230 > 42.51.136.235.23314: UDP, length 32
18:18:30.789702 IP 183.30.229.24.56249 > 42.51.164.3.12378: Flags [.], ack 3830037122, win 16530, length 0
18:18:30.789704 IP 49.69.34.183.1430 > 42.51.136.227.59608: UDP, length 32
18:18:30.789706 IP 157.55.39.102.18528 > 42.51.130.8.80: Flags [.], ack 2920932999, win 64240, length 0
18:18:30.790147 IP 183.69.195.112.20854 > 42.51.140.3.12378: Flags [.], ack 3138938516, win 16560, length 0
18:18:30.790169 IP 124.160.175.151.10094 > 42.51.143.236.22291: Flags [P.], seq 3184130452:3184130512, ack 2980068106, win 1831, options [nop,nop,TS val 3822637236 ecr 814725137], length 60
18:18:30.790185 IP 183.232.118.20.80 > 42.51.140.57.49787: Flags [.], ack 3048623064, win 54, options [nop,nop,TS val 3769114006 ecr 814732422], length 0
18:18:30.790205 IP 112.238.153.27.59705 > 42.51.134.142.40391: UDP, length 20
18:18:30.790231 IP 115.236.148.159.10036 > 42.51.163.213.34439: Flags [P.], seq 2199171762:2199172390, ack 1897220688, win 1159, options [nop,nop,TS val 3822637157 ecr 796045792], length 628
18:18:30.790239 IP 218.76.40.194.51368 > 42.51.132.29.5555: Flags [.], ack 1974274019, win 32768, length 0
18:18:30.790250 IP 60.211.254.134.59458 > 42.51.131.29.5555: Flags [.], ack 4260945680, win 32752, length 0
18:18:30.790275 IP 221.10.51.117.6866 > 42.51.136.234.22410: UDP, length 32
18:18:30.790283 IP 221.10.51.117.9126 > 42.51.136.234.18632: UDP, length 32
18:18:30.790299 IP 115.236.148.151.10130 > 42.51.134.160.52104: Flags [P.], seq 3077985416:3077985579, ack 21566279, win 43, options [nop,nop,TS val 2161295627 ecr 814755922], length 163
18:18:30.790315 IP 106.84.31.160.58937 > 42.51.140.179.12378: Flags [.], ack 2199025736, win 16265, length 0
18:18:30.790332 IP 112.90.78.176.80 > 42.51.155.141.2430: Flags [F.], seq 3296712944, ack 59523769, win 6432, length 0
18:18:30.790345 IP 112.92.37.64.59626 > 42.51.164.12.12378: Flags [P.], seq 2483960492:2483960584, ack 9301002, win 16384, length 92
18:18:30.790360 IP 112.90.78.176.80 > 42.51.156.137.4286: Flags [P.], seq 3336983291:3336983341, ack 2507392079, win 6432, length 50
18:18:30.790364 IP 117.95.24.17.5523 > 42.51.131.189.5555: Flags [.], ack 2471125294, win 65453, length 0
18:18:30.790377 IP 112.242.12.247.27564 > 42.51.144.32.12378: Flags [.], ack 1211354645, win 16574, length 0
18:18:30.790390 IP 221.10.51.117.9164 > 42.51.136.234.29116: UDP, length 32
18:18:30.790405 IP 61.182.131.215.8082 > 42.51.159.35.1122: Flags [P.], seq 2422322858:2422323326, ack 3465395694, win 65535, length 468
18:18:30.790420 IP 180.153.236.71.31875 > 42.51.136.203.80: Flags [.], ack 1492133361, win 58, options [nop,nop,TS val 1783070025 ecr 4696544], length 0
18:18:30.790436 IP 113.138.75.244.5895 > 42.51.131.193.5555: Flags [P.], seq 1988634064:1988634068, ack 4090005516, win 32756, length 4
18:18:30.790444 IP 42.202.27.216.27000 > 42.51.136.233.61058: UDP, length 32
18:18:30.790456 IP 221.228.202.64.40822 > 42.51.132.146.8245: Flags [.], seq 2901469057:2901470517, ack 1705789777, win 433, length 1460
18:18:30.790506 IP 124.160.175.151.10094 > 42.51.140.160.50888: Flags [P.], seq 3261228338:3261229335, ack 3166482604, win 1897, options [nop,nop,TS val 3822637236 ecr 814732417], length 997
18:18:30.790509 IP 112.242.12.247.27570 > 42.51.144.140.12378: Flags [.], ack 2526065089, win 16522, length 0
18:18:30.790510 IP 182.118.223.88.62402 > 42.51.164.248.46749: UDP, length 24
18:18:30.790512 IP 124.160.175.151.10089 > 42.51.140.113.48884: Flags [P.], seq 2720078749:2720079297, ack 2034258845, win 3120, options [nop,nop,TS val 3822636637 ecr 814732440], length 548
18:18:30.790517 IP 221.10.51.117.7124 > 42.51.136.243.23330: UDP, length 32
18:18:30.790523 IP 121.25.201.252.49770 > 42.51.131.73.5555: Flags [P.], seq 2167232230:2167232323, ack 3779927247, win 65535, length 93
18:18:30.790529 IP 112.90.78.176.80 > 42.51.153.99.2333: Flags [F.], seq 3316004835, ack 1928007969, win 6432, length 0
18:18:30.790536 IP 112.90.78.176.80 > 42.51.153.99.2332: Flags [P.], seq 3329212540:3329212723, ack 1892011889, win 6432, length 183
18:18:30.790542 IP 121.14.64.19.3123 > 42.51.160.175.22638: Flags [P.], seq 3343437849:3343437857, ack 2633453962, win 94, options [nop,nop,TS val 1430233881 ecr 796632521], length 8
18:18:30.790546 IP 112.90.78.176.80 > 42.51.153.99.2332: Flags [F.], seq 233, ack 1, win 6432, length 0
18:18:30.790559 IP 112.65.196.50.6060 > 42.51.144.81.36887: Flags [P.], seq 3380652884:3380653132, ack 15475529, win 164, options [nop,nop,TS val 3583268451 ecr 795750526], length 248
18:18:30.790574 IP 42.48.109.199.28331 > 42.51.129.150.80: Flags [.], ack 2060449243, win 340, options [nop,nop,TS val 1460951820 ecr 33373306], length 0
18:18:30.790579 IP 14.146.63.241.55034 > 42.51.131.106.5555: Flags [.], ack 670315215, win 65535, length 0
18:18:30.790654 IP 59.172.172.30.5684 > 42.51.161.45.8000: Flags [.], ack 653893204, win 16606, length 0
18:18:30.790656 IP 123.149.156.107.10317 > 42.51.164.208.12378: Flags [P.], seq 2730798638:2730798648, ack 271895058, win 16448, length 10
18:18:30.790657 IP 58.47.204.107.4864 > 42.51.136.242.53492: UDP, length 32
18:18:30.790659 IP 101.226.129.155.12140 > 42.51.140.176.60199: Flags [P.], seq 4163478398:4163479438, ack 3791007891, win 148, options [nop,nop,TS val 1253327553 ecr 814732426], length 1040
18:18:30.790662 IP 182.140.185.173.10026 > 42.51.163.94.24887: Flags [P.], seq 4192776436:4192776504, ack 2363938652, win 758, options [nop,nop,TS val 1387420630 ecr 796045700], length 68
18:18:30.790664 IP 1.198.167.93.7078 > 42.51.136.233.40402: UDP, length 32
18:18:30.790669 IP 221.226.56.231.3389 > 42.51.154.201.54857: Flags [.], seq 1006654437:1006657357, ack 431562164, win 512, length 2920
18:18:30.790704 IP 61.182.131.222.8084 > 42.51.159.35.1596: Flags [P.], seq 4230629361:4230629642, ack 2839304684, win 65535, length 281
18:18:30.790706 IP 163.142.59.105.51439 > 42.51.163.85.12378: Flags [.], ack 1570390323, win 16353, length 0
18:18:30.790708 IP 115.182.84.85.3389 > 42.51.154.242.2054: Flags [P.], seq 3990467071:3990468531, ack 4010026402, win 64032, length 1460
18:18:30.790709 IP 124.91.97.85.7076 > 42.51.136.238.57928: UDP, length 32
18:18:30.790711 IP 113.109.28.123.7076 > 42.51.136.238.44818: UDP, length 32
18:18:30.790712 IP 125.70.16.57.5820 > 42.51.136.241.28078: UDP, length 32
18:18:30.790719 IP 223.104.177.247.31696 > 42.51.136.242.47674: UDP, length 32
18:18:30.790735 IP 221.226.56.231.3389 > 42.51.154.201.54857: Flags [P.], seq 2920:7300, ack 1, win 512, length 4380
18:18:30.790741 IP 114.245.226.140.27078 > 42.51.131.29.5555: Flags [P.], seq 3341099070:3341099074, ack 35682171, win 32768, length 4
18:18:30.790743 IP 123.160.62.190.56236 > 42.51.160.46.12378: Flags [P.], seq 465543130:465543159, ack 2215923498, win 16605, length 29
18:18:30.790749 IP 123.126.46.224.5134 > 42.51.163.225.52505: UDP, length 42
18:18:30.790804 IP 112.90.78.176.80 > 42.51.156.155.3305: Flags [S.], seq 702998382, ack 1595940897, win 5760, options [mss 1440,nop,nop,sackOK], length 0
18:18:30.790807 IP 222.219.138.100.7078 > 42.51.136.242.38022: UDP, length 32
18:18:30.790809 IP 115.236.148.151.10130 > 42.51.140.133.65106: Flags [P.], seq 1506791885:1506792048, ack 1468299169, win 43, options [nop,nop,TS val 2161295627 ecr 814732346], length 163
18:18:30.790810 IP 49.114.78.21.1026 > 42.51.136.238.60026: UDP, length 32
18:18:30.790812 IP 115.236.148.151.10117 > 42.51.163.224.55252: Flags [P.], seq 4002990028:4002990452, ack 2259094485, win 3076, options [nop,nop,TS val 3822635741 ecr 796045791], length 424
18:18:30.790814 IP 119.190.238.46.64594 > 42.51.136.233.54978: UDP, length 32
18:18:30.790815 IP 111.85.105.202.59754 > 42.51.156.49.80: Flags [.], ack 2149939794, win 16425, length 0
18:18:30.790818 IP 117.92.12.129.6976 > 42.51.136.238.64580: UDP, length 32
18:18:30.790819 IP 183.30.229.24.56157 > 42.51.134.90.12378: Flags [.], ack 3564602850, win 16481, length 0
18:18:30.790821 IP 125.39.136.82.3122 > 42.51.163.248.26568: Flags [P.], seq 3680138007:3680138046, ack 4221274388, win 102, options [nop,nop,TS val 1775661742 ecr 796045747], length 39
18:18:30.790827 IP 112.90.78.176.80 > 42.51.156.155.3300: Flags [.], ack 3859638559, win 6432, length 0
18:18:30.790834 IP 123.151.10.160.443 > 42.51.164.4.49735: Flags [.], ack 1588882798, win 501, options [nop,nop,TS val 763526109 ecr 795815454], length 0
18:18:30.790843 IP 124.238.53.250.16459 > 42.51.136.238.42556: UDP, length 32
18:18:30.790848 IP 1.60.114.230.29827 > 42.51.131.46.5555: Flags [.], ack 3396090186, win 32753, length 0
18:18:30.790879 IP 221.205.222.16.32544 > 42.51.136.238.51838: UDP, length 32
18:18:30.790882 IP 125.39.136.83.3117 > 42.51.140.248.37221: Flags [P.], seq 3895482987:3895482995, ack 2998927504, win 102, options [nop,nop,TS val 1892728014 ecr 814732409], length 8
18:18:31.665624 IP 118.122.116.30.23962 > 42.51.136.243.29560: UDP, length 32
18:18:31.665626 IP 112.90.78.176.80 > 42.51.153.218.3359: Flags [S.], seq 718833740, ack 766974311, win 5760, options [mss 1440,nop,nop,sackOK], length 0
18:18:31.665631 IP 101.226.76.208.10092 > 42.51.143.116.52651: Flags [P.], seq 2183894587:2183894783, ack 3753594019, win 784, options [nop,nop,TS val 2708780673 ecr 814726043], length 196
18:18:31.665633 IP 118.122.116.30.29478 > 42.51.136.234.19062: UDP, length 32
18:18:31.665635 IP 120.86.156.72.27504 > 42.51.136.233.36664: UDP, length 32
18:18:31.665636 IP 221.228.202.64.47092 > 42.51.161.50.8021: Flags [.], ack 1821138170, win 1153, length 0
18:18:31.665638 IP 121.14.64.97.3126 > 42.51.144.55.54879: Flags [P.], seq 1805665930:1805666072, ack 3178287065, win 94, options [nop,nop,TS val 1430222545 ecr 795751399], length 142
18:18:31.665640 IP 112.224.17.238.30779 > 42.51.136.238.43936: UDP, length 32
18:18:31.665642 IP 27.196.115.131.5521 > 42.51.131.151.5555: Flags [.], ack 3296657457, win 32762, length 0
18:18:31.665643 IP 60.165.99.209.8038 > 42.51.160.148.33110: UDP, length 280
18:18:31.665646 IP 1.183.179.140.49632 > 42.51.140.192.12378: Flags [.], ack 1237590582, win 16242, length 0
18:18:31.665651 IP 112.67.207.82.7076 > 42.51.136.238.57860: UDP, length 32
18:18:31.665652 IP 117.136.70.113.46324 > 42.51.139.168.5222: Flags [P.], seq 4188820746:4188821003, ack 1339855582, win 5468, options [nop,nop,TS val 6019131 ecr 742817657], length 257
18:18:31.665655 IP 140.206.160.111.10231 > 42.51.144.148.50879: UDP, length 13
18:18:31.665656 IP 119.147.162.106.27005 > 42.51.143.161.4792: Flags [P.], seq 1702923763:1702923784, ack 2143670052, win 259, options [nop,nop,TS val 89489257 ecr 814726039], length 21
18:18:31.665658 IP 125.39.240.42.12021 > 42.51.164.215.56174: Flags [P.], seq 2700808458:2700808512, ack 2900375869, win 3624, options [nop,nop,TS val 2533763663 ecr 795816328], length 54
18:18:31.665660 IP 116.249.102.120.1390 > 42.51.161.45.5555: Flags [P.], seq 3173093465:3173093469, ack 4139982674, win 16080, length 4
18:18:31.665662 IP 182.150.168.18.41605 > 42.51.136.242.45334: UDP, length 32
18:18:31.665663 IP 121.14.64.97.3126 > 42.51.144.55.54814: Flags [P.], seq 3329439718:3329439726, ack 3220190393, win 94, options [nop,nop,TS val 1430222545 ecr 795751389], length 8
18:18:31.665665 IP 125.39.240.42.12021 > 42.51.144.176.61465: Flags [P.], seq 71752373:71752427, ack 2558762549, win 2056, options [nop,nop,TS val 2533763663 ecr 795751433], length 54
18:18:31.665667 IP 36.249.121.131.2054 > 42.51.136.242.35720: UDP, length 32
18:18:31.665669 IP 125.39.240.42.12021 > 42.51.164.97.57964: Flags [P.], seq 256617708:256617762, ack 1842331847, win 5594, options [nop,nop,TS val 2533763663 ecr 795816328], length 54
18:18:31.665671 IP 218.57.220.110.63732 > 42.51.161.16.8001: Flags [.], ack 1083843405, win 16390, length 0
18:18:31.665674 IP 122.7.223.167.7078 > 42.51.136.242.39238: UDP, length 32
18:18:31.665675 IP 60.191.222.216.30002 > 42.51.144.210.54302: Flags [P.], seq 2113997668:2113997708, ack 566527910, win 32760, options [nop,nop,TS val 8997770 ecr 795751415], length 40
18:18:31.665677 IP 121.14.64.97.3126 > 42.51.144.55.54818: Flags [P.], seq 1584152959:1584152967, ack 536768163, win 94, options [nop,nop,TS val 1430222545 ecr 795751389], length 8
18:18:31.665679 IP 101.27.27.17.52102 > 42.51.164.80.12378: Flags [.], ack 2017362294, win 16352, length 0
18:18:31.665682 IP 42.202.197.133.12644 > 42.51.163.223.40381: UDP, length 24
18:18:31.665684 IP 61.174.147.40.21017 > 42.51.144.223.12378: Flags [.], ack 439966349, win 64048, length 0
18:18:31.665685 IP 113.107.136.232.8220 > 42.51.136.241.48072: UDP, length 32
18:18:31.665687 IP 125.66.66.7.58315 > 42.51.140.96.12378: Flags [.], ack 3152055828, win 253, length 0
18:18:31.666097 IP 125.39.136.29.3134 > 42.51.160.42.51058: Flags [P.], seq 1282663353:1282663361, ack 461941941, win 94, options [nop,nop,TS val 1542938009 ecr 796633396], length 8
18:18:31.666137 IP 60.191.222.146.31262 > 42.51.164.56.2425: Flags [P.], seq 498987375:498987762, ack 337339143, win 32584, options [nop,nop,TS val 9003419 ecr 795816314], length 387
18:18:31.666164 IP 183.35.151.20.4503 > 42.51.136.233.47582: UDP, length 32
18:18:31.666173 IP 182.121.49.150.58711 > 42.51.134.45.34719: UDP, length 32
18:18:31.666190 IP 101.227.139.184.10037 > 42.51.134.251.50435: Flags [P.], seq 1335562363:1335562408, ack 617980849, win 758, options [nop,nop,TS val 1386782329 ecr 814756825], length 45
18:18:31.666212 IP 101.226.76.208.10093 > 42.51.143.97.33724: Flags [P.], seq 2055340974:2055341170, ack 3277049450, win 362, options [nop,nop,TS val 2708780673 ecr 814726043], length 196
18:18:31.666238 IP 221.10.51.110.8092 > 42.51.136.235.30634: UDP, length 32
18:18:31.666250 IP 115.236.158.159.5118 > 42.51.140.243.59750: UDP, length 629
18:18:31.666275 IP 121.234.90.147.65285 > 42.51.160.69.12378: Flags [.], ack 4197435870, win 16355, length 0
18:18:31.666283 IP 121.14.64.19.3115 > 42.51.160.184.26414: Flags [P.], seq 4127241710:4127241755, ack 328643534, win 102, options [nop,nop,TS val 1430234762 ecr 796633396], length 45
18:18:31.666293 IP 110.248.97.212.23063 > 42.51.136.242.50630: UDP, length 32
18:18:31.666301 IP 123.151.148.62.12021 > 42.51.144.60.61340: Flags [P.], seq 2787974841:2787974895, ack 760819485, win 2190, options [nop,nop,TS val 2533763663 ecr 795751420], length 54
18:18:31.666324 IP 180.97.163.46.8611 > 42.51.164.69.53405: Flags [P.], seq 3437651690:3437651722, ack 4184214583, win 252, length 32
18:18:31.666329 IP 118.122.116.30.26620 > 42.51.136.234.16568: UDP, length 32
18:18:31.666376 IP 83.110.147.177.7076 > 42.51.136.242.62476: UDP, length 32
18:18:31.666379 IP 60.191.222.216.30012 > 42.51.134.50.4544: Flags [.], seq 663757933:663758457, ack 960797724, win 32592, options [nop,nop,TS val 8997770 ecr 814753589], length 524
18:18:31.666381 IP 60.191.222.216.30012 > 42.51.134.50.4544: Flags [.], seq 524:1048, ack 1, win 32592, options [nop,nop,TS val 8997770 ecr 814753589], length 524
18:18:31.666388 IP 118.122.116.30.31840 > 42.51.136.234.31324: UDP, length 32
18:18:31.666397 IP 60.191.222.216.30012 > 42.51.140.223.54755: Flags [.], seq 1656889438:1656889962, ack 361469192, win 32592, options [nop,nop,TS val 8997770 ecr 814730012], length 524
18:18:31.666405 IP 61.128.254.177.3389 > 42.51.154.242.2372: Flags [P.], seq 801806008:801806394, ack 1522932424, win 64592, length 386
18:18:31.666408 IP 101.226.76.208.10093 > 42.51.134.97.62423: Flags [P.], seq 2904938814:2904939086, ack 2607196229, win 467, options [nop,nop,TS val 2708780674 ecr 814756881], length 272
18:18:31.666414 IP 202.97.130.168.49889 > 42.51.136.233.47262: UDP, length 32
18:18:31.666432 IP 112.242.12.247.27734 > 42.51.144.217.12378: Flags [P.], seq 112236709:112236748, ack 1724848207, win 16516, length 39
18:18:31.666443 IP 36.62.4.44.8837 > 42.51.169.124.80: Flags [.], ack 2231433486, win 12266, options [nop,nop,TS val 244141 ecr 240537387], length 0
18:18:31.666520 IP 49.4.164.209.7076 > 42.51.136.242.63814: UDP, length 32
18:18:31.666522 IP 60.223.152.255.1589 > 42.51.136.238.62754: VQP version 128 packet not supported
18:18:31.666524 IP 60.191.222.146.31262 > 42.51.160.249.1820: Flags [P.], seq 4236570381:4236570768, ack 565122023, win 32584, options [nop,nop,TS val 9003419 ecr 796633425], length 387
18:18:31.666526 IP 123.8.157.140.1418 > 42.51.136.242.36844: UDP, length 32
18:18:31.666527 IP 27.84.236.25.14058 > 42.51.136.233.56202: UDP, length 32
18:18:31.666529 IP 219.133.232.107.13173 > 42.51.136.238.58518: UDP, length 32
18:18:31.666532 IP 60.191.222.216.30012 > 42.51.140.223.54755: Flags [P.], seq 1048:1536, ack 1, win 32592, options [nop,nop,TS val 8997770 ecr 814730012], length 488
18:18:31.666539 IP 122.241.208.84.49272 > 42.51.131.46.5555: Flags [.], ack 3575447801, win 65465, length 0
18:18:31.666587 IP 118.122.116.30.25790 > 42.51.136.234.29990: UDP, length 32
18:18:31.666640 IP 125.70.16.40.6512 > 42.51.136.243.20800: UDP, length 32
18:18:31.666642 IP 119.85.115.110.15332 > 42.51.160.59.12378: Flags [.], ack 2096269414, win 16355, length 0
18:18:31.666643 IP 221.228.193.85.9223 > 42.51.160.112.58476: Flags [P.], seq 679385057:679385073, ack 2097464396, win 32044, options [nop,nop,TS val 2141673348 ecr 796633417], length 16
18:18:31.666645 IP 182.121.55.242.46243 > 42.51.140.58.60934: UDP, length 34
18:18:31.666647 IP 60.180.32.208.23579 > 42.51.161.23.8001: Flags [P.], seq 1083593615:1083593651, ack 439711606, win 254, length 36
18:18:31.666650 IP 14.122.147.208.41430 > 42.51.139.165.5222: Flags [P.], seq 3795119796:3795119968, ack 381842258, win 1222, options [nop,nop,TS val 8779396 ecr 1055622350], length 172
18:18:31.666656 IP 182.121.55.242.48377 > 42.51.134.87.36642: UDP, length 52
18:18:31.666671 IP 118.123.252.103.5106 > 42.51.144.109.33051: UDP, length 35
18:18:31.666677 IP 122.244.49.185.25186 > 42.51.136.242.40986: UDP, length 32
18:18:31.666702 IP 1.204.78.78.8688 > 42.51.131.139.5555: Flags [.], ack 3924148584, win 65535, length 0
18:18:31.666704 IP 58.215.54.13.29001 > 42.51.140.11.5635: Flags [P.], seq 3885042409:3885042449, ack 2098417405, win 10080, options [nop,nop,TS val 1209678021 ecr 814733154], length 40
18:18:31.666711 IP 39.83.47.204.1773 > 42.51.131.138.5555: Flags [P.], seq 2520412822:2520412950, ack 4125032162, win 32768, length 128
18:18:31.666713 IP 153.34.178.250.7076 > 42.51.136.238.58386: UDP, length 32
18:18:31.666722 IP 60.28.116.248.8815 > 42.51.132.206.8001: Flags [.], ack 1841631988, win 16226, options [nop,nop,TS val 760715 ecr 286722857], length 0
18:18:31.666726 IP 114.80.208.4.3389 > 42.51.154.242.2382: Flags [P.], seq 671399615:671399667, ack 3555365877, win 64085, length 52
18:18:31.666730 IP 84.192.184.30.7078 > 42.51.136.242.62108: UDP, length 32
18:18:31.666739 IP 125.70.16.53.6660 > 42.51.136.234.31784: UDP, length 32
18:18:31.666743 IP 27.154.20.162.49605 > 42.51.138.69.8001: Flags [.], ack 1370661782, win 16284, length 0
18:18:31.666750 IP 121.14.64.164.3115 > 42.51.140.30.18892: Flags [P.], seq 2916334134:2916334198, ack 3113004759, win 94, options [nop,nop,TS val 1430127664 ecr 814733310], length 64
18:18:31.666757 IP 202.97.221.107.49176 > 42.51.132.158.8252: Flags [P.], seq 2183719749:2183719794, ack 2655926475, win 16452, length 45
18:18:31.666767 IP 125.70.16.53.6036 > 42.51.136.234.32742: UDP, length 32
18:18:31.666773 IP 122.228.79.96.9223 > 42.51.160.183.55248: Flags [.], ack 2117649602, win 32044, options [nop,nop,TS val 3942704782 ecr 796633424], length 0
18:18:31.666777 IP 157.61.158.75.18495 > 42.51.136.238.43064: UDP, length 32
18:18:31.666783 IP 121.14.64.61.3120 > 42.51.144.71.5879: Flags [.], ack 427701180, win 63, options [nop,nop,TS val 2455865771 ecr 795751417], length 0
18:18:31.666790 IP 115.236.148.151.10028 > 42.51.144.156.19743: Flags [P.], seq 1643280819:1643280911, ack 1438324169, win 111, options [nop,nop,TS val 1048110284 ecr 795751334], length 92
18:18:31.666801 IP 27.50.184.241.88 > 42.51.155.155.48751: Flags [P.], seq 3470784181:3470788325, ack 2136737377, win 309, options [nop,nop,TS val 260234865 ecr 429399418], length 4144
18:18:31.666803 IP 121.14.64.5.3116 > 42.51.160.234.64290: Flags [P.], seq 2171898009:2171898151, ack 884661407, win 94, options [nop,nop,TS val 1430231099 ecr 796633398], length 142
18:18:31.666817 IP 114.217.78.76.12561 > 42.51.144.183.12378: Flags [.], ack 72784939, win 256, length 0
18:18:31.666822 IP 117.136.94.204.42164 > 42.51.139.162.5222: Flags [.], ack 2432965919, win 2646, options [nop,nop,TS val 7982840 ecr 3910178651], length 0
18:18:31.666827 IP 101.226.76.208.10093 > 42.51.163.108.32732: Flags [P.], seq 3642174501:3642174833, ack 2778604717, win 507, options [nop,nop,TS val 2708780673 ecr 796046653], length 332
18:18:31.666834 IP 118.123.22.244.80 > 42.51.156.208.4576: Flags [.], ack 979975129, win 65120, length 0
18:18:31.666838 IP 118.123.22.244.80 > 42.51.156.208.4576: Flags [R.], seq 0, ack 1, win 0, length 0
18:18:31.666843 IP 101.226.76.208.10092 > 42.51.140.8.50103: Flags [P.], seq 3878266334:3878266590, ack 4281706864, win 546, options [nop,nop,TS val 2708780674 ecr 814733304], length 256
18:18:31.666862 IP 101.226.76.208.10092 > 42.51.144.169.52413: Flags [P.], seq 3147103510:3147103902, ack 2254582512, win 744, options [nop,nop,TS val 2708780673 ecr 795751411], length 392
18:18:31.666866 IP 113.236.190.195.56490 > 42.51.144.63.12378: Flags [P.], seq 3275783756:3275783816, ack 3713306799, win 16434, length 60
18:18:31.666885 IP 125.39.136.83.3120 > 42.51.160.13.60580: Flags [P.], seq 2465056358:2465056366, ack 2539144216, win 106, options [nop,nop,TS val 1892728889 ecr 796633399], length 8
18:18:35.137566 IP 14.23.248.12.21621 > 42.51.136.238.42554: UDP, length 32
18:18:35.137570 IP 36.7.141.42.49240 > 42.51.132.199.8001: Flags [.], ack 2501158150, win 16242, length 0
18:18:35.137571 IP 221.4.205.109.2505 > 42.51.139.162.5222: Flags [.], ack 4045795632, win 724, options [nop,nop,TS val 1362976 ecr 3910182257], length 0
18:18:35.137572 IP 101.226.76.208.10060 > 42.51.163.124.7330: Flags [P.], seq 2830484721:2830485616, ack 994424637, win 164, options [nop,nop,TS val 2708782024 ecr 796050125], length 895
18:18:35.137575 IP 222.211.64.111.80 > 42.51.144.207.20896: Flags [.], seq 171930904:171935284, ack 2263995261, win 123, length 4380
18:18:35.137615 IP 59.58.79.234.65290 > 42.51.131.150.8001: Flags [.], ack 2556172149, win 64560, length 0
18:18:35.137618 IP 157.122.148.179.37097 > 42.51.136.242.44452: UDP, length 32
18:18:35.137619 IP 221.10.51.110.8736 > 42.51.136.243.25302: UDP, length 32
18:18:35.137620 IP 101.226.76.208.10092 > 42.51.160.23.8458: Flags [P.], seq 3141359739:3141359799, ack 2799069419, win 1364, options [nop,nop,TS val 2708781541 ecr 796636830], length 60
18:18:35.137622 IP 121.14.64.180.3125 > 42.51.160.154.26490: Flags [P.], seq 1826554874:1826554946, ack 3671613209, win 102, options [nop,nop,TS val 1430234440 ecr 796636893], length 72
18:18:35.137623 IP 112.239.8.92.26515 > 42.51.160.47.12378: Flags [.], ack 1578286553, win 16602, length 0
18:18:35.137693 IP 183.167.213.229.1536 > 42.51.132.88.5555: Flags [P.], seq 1181962029:1181962033, ack 2794390261, win 32753, length 4
18:18:35.137695 IP 101.226.76.208.10093 > 42.51.163.159.33907: Flags [P.], seq 3265760924:3265762074, ack 1697906870, win 124, options [nop,nop,TS val 2708781541 ecr 796050124], length 1150
18:18:35.137697 IP 58.251.146.173.4861 > 42.51.136.233.47608: UDP, length 32
18:18:35.137699 IP 101.226.76.208.10092 > 42.51.143.247.1612: Flags [P.], seq 681319897:681319957, ack 2344721263, win 1390, options [nop,nop,TS val 2708781541 ecr 814729454], length 60
18:18:35.137701 IP 106.92.245.153.35753 > 42.51.131.150.8001: Flags [P.], seq 3554148886:3554148901, ack 1839808276, win 64782, length 15
18:18:35.137702 IP 42.51.4.177.443 > 42.51.150.7.50015: Flags [P.], seq 935175901:935176959, ack 1112704367, win 260, options [nop,nop,TS val 95026016 ecr 3006956987], length 1058
18:18:35.137705 IP 125.70.16.53.5882 > 42.51.136.243.18540: UDP, length 32
18:18:35.137709 IP 112.90.78.176.80 > 42.51.156.172.4771: Flags [S.], seq 3398778705, ack 4118510999, win 5760, options [mss 1440,nop,nop,sackOK], length 0
18:18:35.137712 IP 121.31.40.143.54563 > 42.51.136.227.58852: UDP, length 32
18:18:35.137715 IP 178.240.49.127.27363 > 42.51.136.232.8010: UDP, length 58
18:18:35.137716 IP 121.20.244.39.54903 > 42.51.140.11.12378: Flags [.], ack 1691945058, win 16349, length 0
18:18:35.137718 IP 115.236.148.151.10117 > 42.51.144.172.56447: Flags [P.], seq 1871890409:1871890553, ack 1252862189, win 3142, options [nop,nop,TS val 3822636828 ecr 795754892], length 144
18:18:35.137720 IP 139.226.23.75.50731 > 42.51.139.162.5222: Flags [P.], seq 1615272546:1615272730, ack 475445234, win 262, options [nop,nop,TS val 60768 ecr 3910182247], length 184
18:18:35.137721 IP 118.122.116.30.30578 > 42.51.136.243.18138: UDP, length 32
