18:05:00.887869 IP 114.43.14.87.55933 > 42.51.129.73.80: Flags [.], ack 1477680007, win 123, options [nop,nop,TS val 2576844 ecr 1481568479,nop,nop,sack 1 {0:1}], length 0
18:05:00.887873 IP 111.206.36.19.24950 > 103.22.191.34.80: Flags [.], ack 3864232867, win 423, length 0
18:05:00.887878 IP 120.52.18.60.16878 > 42.51.15.3.80: Flags [.], ack 1411924377, win 120, length 0
18:05:00.887881 IP 120.52.18.60.16878 > 42.51.15.3.80: Flags [.], ack 679, win 123, length 0
18:05:00.887886 IP 120.52.18.60.16878 > 42.51.15.3.80: Flags [.], ack 2049, win 121, length 0
18:05:00.887891 IP 117.34.28.13.36784 > 42.51.1.161.80: Flags [.], ack 3690963243, win 702, options [nop,nop,TS val 1102407967 ecr 1109834], length 0
18:05:00.887894 IP 120.52.18.60.16878 > 42.51.15.3.80: Flags [.], ack 2727, win 120, length 0
18:05:00.887899 IP 120.52.18.60.16878 > 42.51.15.3.80: Flags [.], ack 3172, win 120, length 0
18:05:00.887904 IP 120.13.136.190.26561 > 42.51.11.89.80: Flags [.], ack 1506210716, win 16698, length 0
18:05:00.887916 IP 124.167.224.138.51648 > 42.51.10.106.80: Flags [.], ack 1044961104, win 64028, length 0
18:05:00.887965 IP 120.52.18.60.16878 > 42.51.15.3.80: Flags [F.], seq 0, ack 3173, win 125, length 0
18:05:00.888018 IP 111.206.36.19.24950 > 103.22.191.34.80: Flags [.], ack 1461, win 434, length 0
18:05:00.888023 IP 111.206.36.19.24950 > 103.22.191.34.80: Flags [.], ack 2049, win 445, length 0
18:05:00.888027 IP 119.189.45.56.1544 > 42.51.11.80.80: Flags [S], seq 1453992052, win 65535, options [mss 1440,nop,wscale 1,nop,nop,sackOK], length 0
18:05:00.888032 IP 117.21.173.120.3577 > 42.51.15.142.3389: Flags [P.], seq 455600980:455600992, ack 2036538234, win 65169, length 12
18:05:00.888034 IP 43.240.57.209.3484 > 42.51.11.100.80: Flags [.], ack 2688217264, win 16491, length 0
18:05:00.888039 IP 58.216.14.27.3969 > 42.51.22.86.80: Flags [.], ack 1638704918, win 65535, length 0
18:05:00.888046 IP 121.204.126.17.2232 > 42.51.11.89.80: Flags [.], seq 2752270511:2752271933, ack 4124059452, win 16708, length 1422
18:05:00.888123 IP 123.138.254.217.18832 > 42.51.11.100.80: Flags [.], ack 2191154583, win 258, length 0
18:05:00.888191 IP 119.189.45.56.1537 > 42.51.11.89.80: Flags [P.], seq 4094144302:4094145056, ack 484102330, win 32768, length 754
18:05:00.888198 IP 58.252.77.186.55974 > 42.51.7.97.80: Flags [.], ack 1131103208, win 1726, options [nop,nop,TS val 12840387 ecr 20651410], length 0
18:05:00.888202 IP 221.213.104.227.60445 > 42.51.145.122.80: Flags [.], ack 1961284459, win 4998, options [nop,nop,TS val 4552025 ecr 142551525], length 0
18:05:00.888247 IP 117.34.28.13.36784 > 42.51.1.161.80: Flags [.], ack 1449, win 725, options [nop,nop,TS val 1102407967 ecr 1109834], length 0
18:05:00.888251 IP 117.34.28.13.36784 > 42.51.1.161.80: Flags [.], ack 2049, win 747, options [nop,nop,TS val 1102407967 ecr 1109834], length 0
18:05:00.888310 IP 27.198.78.85.3443 > 42.51.11.89.80: Flags [S], seq 2599496586, win 65535, options [mss 1440,nop,wscale 0,nop,nop,sackOK], length 0
18:05:00.888316 IP 60.222.97.187.3315 > 42.51.25.22.80: Flags [.], seq 1966495427:1966496867, ack 1132095089, win 63888, length 1440
18:05:00.888367 IP 117.34.28.13.36784 > 42.51.1.161.80: Flags [.], ack 3497, win 770, options [nop,nop,TS val 1102407967 ecr 1109834], length 0
18:05:00.888371 IP 111.251.174.97.51169 > 42.51.129.73.80: Flags [S], seq 1149698049, win 65535, options [mss 1460,nop,wscale 6,sackOK,TS val 1528486140 ecr 0], length 0
18:05:00.888374 IP 112.4.172.230.1407 > 103.22.191.156.3389: Flags [.], ack 202070038, win 65535, length 0
18:05:00.888376 IP 111.206.36.19.24950 > 103.22.191.34.80: Flags [.], ack 3509, win 457, length 0
18:05:00.888380 IP 113.108.11.50.41729 > 42.51.26.98.80: Flags [S], seq 2395498786, win 5840, options [mss 1460,sackOK,TS val 3546460582 ecr 0,nop,wscale 7], length 0
18:05:00.888433 IP 111.206.36.19.24950 > 103.22.191.34.80: Flags [.], ack 4097, win 468, length 0
18:05:00.888438 IP 113.195.162.138.55563 > 42.51.15.70.3389: Flags [.], ack 1361333055, win 65520, options [nop,nop,sack 2 {5706:17354}{2913:4369}], length 0
18:05:00.888483 IP 125.39.239.149.8519 > 42.51.11.100.80: Flags [S], seq 2001112857, win 8192, options [mss 1420,nop,wscale 2,nop,nop,sackOK], length 0
18:05:00.888487 IP 219.129.255.71.30645 > 42.51.26.70.80: Flags [.], ack 3272713697, win 25773, length 0
18:05:00.888533 IP 175.174.113.230.26415 > 42.51.11.160.80: Flags [.], ack 1200657225, win 8054, options [nop,nop,TS val 11606460 ecr 830701793], length 0
18:05:00.888538 IP 175.174.113.230.26415 > 42.51.11.160.80: Flags [.], ack 1, win 8142, options [nop,nop,TS val 11606461 ecr 830701793], length 0
18:05:00.888541 IP 122.231.152.169.1291 > 42.51.11.60.80: Flags [R], seq 3629624585, win 0, length 0
18:05:00.888546 IP 111.206.36.19.24950 > 103.22.191.34.80: Flags [.], ack 5557, win 480, length 0
18:05:00.888585 IP 86.51.185.98.55325 > 42.51.11.89.80: Flags [.], ack 979797097, win 65534, length 0
18:05:00.888590 IP 111.206.36.19.24950 > 103.22.191.34.80: Flags [.], ack 6145, win 491, length 0
18:05:00.888668 IP 36.226.113.179.64006 > 42.51.129.73.80: Flags [S], seq 2848722370, win 65535, options [mss 1460,sackOK,eol], length 0
18:05:00.888673 IP 222.186.130.49.37590 > 42.51.10.106.80: Flags [.], ack 2028960605, win 137, length 0
18:05:00.888677 IP 113.254.246.87.53017 > 42.51.129.73.80: Flags [.], ack 3906296741, win 490, options [nop,nop,TS val 4522831 ecr 1481568375], length 0
18:05:00.888750 IP 222.186.130.49.37590 > 42.51.10.106.80: Flags [.], ack 2016, win 160, length 0
18:05:00.888809 IP 221.10.57.61.19274 > 42.51.11.100.80: Flags [.], ack 1219729647, win 16652, length 0
18:05:00.888814 IP 113.195.162.138.55608 > 42.51.16.204.3389: Flags [.], ack 586190090, win 65520, length 0
18:05:00.888817 IP 42.156.136.19.48429 > 42.51.4.73.80: Flags [S], seq 4100075385, win 5792, options [mss 1460,sackOK,TS val 2229024963 ecr 8855373,nop,wscale 9], length 0
18:05:00.888859 IP 113.6.148.209.5114 > 42.51.11.109.80: Flags [.], seq 2325562034:2325562035, ack 3880536420, win 32600, length 1
18:05:00.888864 IP 115.46.137.196.35497 > 42.51.129.73.80: Flags [S], seq 1376799905, win 14600, options [mss 1440,sackOK,TS val 225746 ecr 0,nop,wscale 6], length 0
18:05:00.888868 IP 221.213.104.227.60446 > 42.51.145.122.80: Flags [.], ack 3917773282, win 4628, options [nop,nop,TS val 4552027 ecr 142551525], length 0
18:05:00.888975 IP 220.163.112.218.60217 > 42.51.10.106.80: Flags [.], ack 2190414387, win 258, length 0
18:05:00.888984 IP 123.138.254.217.18839 > 42.51.11.100.80: Flags [P.], seq 2795437854:2795438312, ack 4068547984, win 258, length 458
18:05:00.888992 IP 39.86.81.46.57026 > 42.51.11.80.80: Flags [.], ack 1304482226, win 16560, length 0
18:05:00.889035 IP 113.123.4.97.5345 > 42.51.11.100.80: Flags [.], ack 3854746061, win 258, length 0
18:05:00.889041 IP 113.123.4.97.5345 > 42.51.11.100.80: Flags [.], ack 4321, win 258, length 0
18:05:00.889103 IP 183.61.236.16.18011 > 42.51.1.161.80: Flags [.], ack 2929825375, win 318, options [nop,nop,TS val 2565486310 ecr 1109834], length 0
18:05:00.889112 IP 36.46.83.30.51651 > 103.22.189.237.80: Flags [.], ack 2284338337, win 8456, options [nop,nop,TS val 179263043 ecr 7924623], length 0
18:05:00.889117 IP 36.46.83.30.51651 > 103.22.189.237.80: Flags [.], ack 1429, win 8545, options [nop,nop,TS val 179263043 ecr 7924623], length 0
18:05:00.889122 IP 202.85.215.157.44098 > 42.51.23.82.22: Flags [P.], seq 149999733:149999749, ack 3033820659, win 137, options [nop,nop,TS val 2157777090 ecr 873465471], length 16
18:05:00.889124 IP 119.189.45.56.1545 > 42.51.11.80.80: Flags [S], seq 723440029, win 65535, options [mss 1440,nop,wscale 1,nop,nop,sackOK], length 0
18:05:00.889217 IP 183.61.236.16.18011 > 42.51.1.161.80: Flags [.], ack 1, win 318, options [nop,nop,TS val 2565486310 ecr 1109834,nop,nop,sack 1 {4294965542:4294966142}], length 0
18:05:00.889305 IP 220.189.225.210.53869 > 103.22.191.41.80: Flags [P.], seq 4211462477:4211463231, ack 2572972404, win 65160, options [nop,nop,TS val 1230916 ecr 178360584], length 754
18:05:00.889312 IP 182.148.23.88.60201 > 42.51.26.70.80: Flags [R.], seq 1863882715, ack 1526190361, win 0, length 0
18:05:00.889316 IP 118.114.160.70.22836 > 42.51.11.60.80: Flags [.], ack 2336120343, win 16507, length 0
18:05:00.889319 IP 114.253.61.183.3290 > 42.51.0.209.80: Flags [.], ack 3748082081, win 32768, length 0
18:05:00.889324 IP 36.46.83.30.51651 > 103.22.189.237.80: Flags [.], ack 4285, win 8456, options [nop,nop,TS val 179263043 ecr 7924623], length 0
18:05:00.889386 IP 220.181.108.150.36477 > 42.51.3.199.80: Flags [.], ack 3921879777, win 132, length 0
18:05:00.889391 IP 60.54.56.154.14608 > 42.51.129.73.80: Flags [S], seq 3200529412, win 14600, options [mss 1400,sackOK,TS val 47867486 ecr 0,nop,wscale 7], length 0
18:05:00.889394 IP 124.65.208.173.3949 > 42.51.11.100.80: Flags [.], ack 3009009290, win 64512, length 0
18:05:00.889438 IP 36.100.208.94.57060 > 42.51.15.12.80: Flags [.], ack 1083570298, win 138, length 0
18:05:00.889442 IP 111.161.77.227.18018 > 42.51.11.100.80: Flags [S], seq 1111882359, win 8192, options [mss 1412,nop,wscale 2,nop,nop,sackOK], length 0
18:05:00.889446 IP 202.85.215.157.40539 > 42.51.15.81.22: Flags [P.], seq 3909108779:3909108931, ack 3947670848, win 126, options [nop,nop,TS val 2157777087 ecr 1063017798], length 152
18:05:00.889539 IP 221.213.104.227.60445 > 42.51.145.122.80: Flags [.], ack 1429, win 5020, options [nop,nop,TS val 4552026 ecr 142551525], length 0
18:05:00.889546 IP 111.26.224.25.34958 > 42.51.4.132.80: Flags [.], ack 1992417823, win 267, options [nop,nop,TS val 697701710 ecr 3059911006], length 0
18:05:00.889550 IP 183.61.236.16.18011 > 42.51.1.161.80: Flags [.], ack 1, win 318, options [nop,nop,TS val 2565486310 ecr 1109834,nop,nop,sack 1 {4294964094:4294965542}], length 0
18:05:00.889555 IP 220.181.108.150.36477 > 42.51.3.199.80: Flags [R.], seq 0, ack 1, win 132, length 0
18:05:00.889593 IP 1.192.143.134.26541 > 42.51.7.62.80: Flags [P.], seq 2519594102:2519595055, ack 2507280273, win 32093, length 953
18:05:00.889600 IP 113.123.4.97.5345 > 42.51.11.100.80: Flags [.], ack 5761, win 258, length 0
18:05:00.889604 IP 108.162.223.155.62287 > 42.51.5.45.80: Flags [.], ack 33050060, win 32, length 0
18:05:00.889608 IP 36.46.83.30.51651 > 103.22.189.237.80: Flags [.], ack 5713, win 8545, options [nop,nop,TS val 179263044 ecr 7924623], length 0
18:05:00.889613 IP 119.186.236.178.1726 > 42.51.11.89.80: Flags [P.], seq 143255694:143256215, ack 2528828707, win 65530, length 521
18:05:00.889699 IP 219.145.171.36.58008 > 103.22.191.5.80: Flags [P.], seq 2638950303:2638951344, ack 2486914803, win 745, length 1041
18:05:00.889708 IP 60.222.159.208.24119 > 42.51.11.89.80: Flags [P.], seq 2133027396:2133028545, ack 2417037907, win 65327, length 1149
18:05:00.889714 IP 115.53.201.232.52508 > 42.51.7.62.80: Flags [P.], seq 914066973:914067406, ack 1286398923, win 16420, length 433
18:05:00.889718 IP 36.46.83.30.51651 > 103.22.189.237.80: Flags [.], ack 8569, win 8456, options [nop,nop,TS val 179263044 ecr 7924623], length 0
18:05:00.889760 IP 202.98.210.246.65099 > 42.51.10.106.80: Flags [.], ack 3239757836, win 16372, length 0
18:05:00.889766 IP 14.18.188.154.19993 > 42.51.26.100.80: Flags [.], ack 3153151746, win 115, options [nop,nop,TS val 12042848 ecr 0], length 0
18:05:00.889811 IP 116.8.109.57.61099 > 42.51.16.17.80: Flags [.], ack 3093256660, win 16448, length 0
18:05:00.889818 IP 116.211.104.64.55061 > 42.51.10.105.80: Flags [.], ack 2977288682, win 137, length 0
18:05:00.889821 IP 116.77.238.4.28181 > 42.51.129.73.80: Flags [F.], seq 4287607844, ack 1951090528, win 495, options [nop,nop,TS val 23047060 ecr 1481560055], length 0
18:05:00.889868 IP 221.229.173.28.19082 > 42.51.11.60.80: Flags [F.], seq 3453674078, ack 1019667901, win 16384, length 0
18:05:00.889874 IP 39.86.81.46.57026 > 42.51.11.80.80: Flags [P.], seq 0:402, ack 1, win 16560, length 402
18:05:00.889883 IP 116.211.104.64.55061 > 42.51.10.105.80: Flags [.], ack 1461, win 160, length 0
18:05:00.889938 IP 116.211.104.64.55061 > 42.51.10.105.80: Flags [.], ack 2921, win 183, length 0
18:05:00.889944 IP 183.196.22.66.54624 > 42.51.0.209.80: Flags [S], seq 3404757270, win 65535, options [mss 1440,nop,wscale 5,nop,nop,TS val 543092851 ecr 0,sackOK,eol], length 0
18:05:00.889951 IP 60.221.138.27.22480 > 103.22.191.41.80: Flags [P.], seq 1883867836:1883868764, ack 177554481, win 606, options [nop,nop,TS val 3892448 ecr 178360891], length 928
18:05:00.889957 IP 221.229.173.28.31926 > 42.51.11.89.80: Flags [F.], seq 2078741307, ack 416237536, win 16384, length 0
18:05:00.889993 IP 116.211.104.64.55061 > 42.51.10.105.80: Flags [.], ack 4381, win 206, length 0
18:05:00.889998 IP 222.168.251.113.4116 > 42.51.4.151.80: Flags [.], ack 1589712645, win 65535, length 0
18:05:02.927859 IP 123.138.17.197.7628 > 42.51.11.160.80: Flags [.], ack 570647547, win 1024, length 0
18:05:02.927865 IP 222.80.58.38.52385 > 42.51.11.100.80: Flags [.], ack 4029300658, win 16425, length 0
18:05:02.927869 IP 106.120.173.81.57505 > 103.22.189.23.80: Flags [.], ack 2222443153, win 14600, length 0
18:05:02.927920 IP 106.120.173.81.57505 > 103.22.189.23.80: Flags [P.], seq 0:421, ack 1, win 14600, length 421
18:05:02.927927 IP 58.221.49.156.2430 > 42.51.0.209.80: Flags [P.], seq 3904267442:3904267824, ack 989309272, win 65535, length 382
18:05:02.927932 IP 108.162.216.48.34374 > 42.51.23.45.80: Flags [.], ack 3549355136, win 157, length 0
18:05:02.927935 IP 58.251.146.186.5369 > 42.51.10.106.80: Flags [P.], seq 3378426816:3378426916, ack 2617132123, win 260, length 100
18:05:02.927941 IP 221.234.20.86.59216 > 42.51.15.20.80: Flags [.], ack 539750945, win 1894, length 0
18:05:02.927945 IP 108.162.216.48.34374 > 42.51.23.45.80: Flags [.], ack 1461, win 159, length 0
18:05:02.927950 IP 175.174.113.230.26417 > 42.51.11.160.80: Flags [.], ack 3702252961, win 4096, options [nop,nop,TS val 11608237 ecr 830701997], length 0
18:05:02.927970 IP 125.39.1.80.41785 > 103.22.191.5.80: Flags [F.], seq 3128389993, ack 1673265436, win 251, length 0
18:05:02.927974 IP 123.138.17.197.7628 > 42.51.11.160.80: Flags [.], ack 1441, win 1024, length 0
18:05:02.927978 IP 123.138.17.197.7628 > 42.51.11.160.80: Flags [.], ack 2881, win 1024, length 0
18:05:02.927982 IP 42.84.34.50.62921 > 42.51.16.15.80: Flags [.], ack 2688511577, win 16308, length 0
18:05:02.928020 IP 123.161.109.120.19901 > 42.51.11.100.80: Flags [.], ack 341567871, win 16448, length 0
18:05:02.928133 IP 61.177.27.42.2628 > 42.51.10.106.80: Flags [.], ack 3415593592, win 64224, options [nop,nop,TS val 104794 ecr 3651229518], length 0
18:05:02.928246 IP 136.243.36.94.50480 > 103.22.191.41.80: Flags [.], ack 1195156542, win 205, options [nop,nop,TS val 133340893 ecr 178361260], length 0
18:05:02.928252 IP 110.251.245.88.3411 > 42.51.11.80.80: Flags [.], ack 2566077663, win 32768, options [nop,nop,sack 3 {22101:44201}{1301:9101}{1301:9101}], length 0
18:05:02.928256 IP 110.251.245.88.3411 > 42.51.11.80.80: Flags [.], ack 1, win 32768, options [nop,nop,sack 3 {22101:45501}{1301:9101}{1301:9101}], length 0
18:05:02.928262 IP 183.171.169.64.63672 > 42.51.23.119.80: Flags [.], ack 3572082423, win 7836, options [nop,nop,TS val 45576 ecr 1342235362], length 0
18:05:02.928266 IP 1.80.125.60.21905 > 42.51.11.100.80: Flags [.], ack 211230276, win 816, options [nop,nop,TS val 10052702 ecr 3956779125], length 0
18:05:02.928271 IP 1.80.125.60.21905 > 42.51.11.100.80: Flags [.], ack 2857, win 906, options [nop,nop,TS val 10052702 ecr 3956779125], length 0
18:05:02.928350 IP 117.21.173.120.3700 > 42.51.7.71.3389: Flags [R], seq 7472589, win 0, length 0
18:05:02.928353 IP 117.21.173.120.3700 > 42.51.7.71.3389: Flags [R], seq 7472589, win 0, length 0
18:05:02.928355 IP 83.110.240.254.40221 > 103.22.189.237.80: Flags [.], ack 1327888260, win 65535, options [nop,nop,TS val 273369905 ecr 7924640], length 0
18:05:02.928361 IP 42.88.106.195.4558 > 42.51.11.100.80: Flags [.], ack 2428065369, win 16448, options [nop,nop,sack 1 {1441:4321}], length 0
18:05:02.928421 IP 27.14.61.118.55276 > 42.51.11.100.80: Flags [.], ack 1012450590, win 258, length 0
18:05:02.928427 IP 60.6.197.15.59796 > 42.51.10.106.80: Flags [S], seq 1247887988, win 14600, options [mss 1460,nop,nop,sackOK,nop,wscale 9], length 0
18:05:02.928431 IP 123.125.71.76.39343 > 42.51.145.37.80: Flags [S], seq 1106452258, win 14600, options [mss 1460,sackOK,nop,nop,nop,nop,nop,nop,nop,nop,nop,nop,nop,wscale 8], length 0
18:05:02.928531 IP 125.39.181.99.3552 > 42.51.11.100.80: Flags [R.], seq 2142895933, ack 4020181418, win 0, length 0
18:05:02.928537 IP 124.166.150.20.27031 > 42.51.11.160.80: Flags [.], ack 3223269882, win 8192, options [nop,nop,TS val 257948588 ecr 830701986,nop,nop,sack 1 {1441:54721}], length 0
18:05:02.928828 IP 123.138.114.154.19110 > 42.51.16.150.80: Flags [.], ack 339088018, win 64009, length 0
18:05:02.928892 IP 14.204.69.13.10051 > 42.51.11.100.80: Flags [.], ack 2824016483, win 16560, length 0
18:05:02.928898 IP 112.66.210.82.62024 > 42.51.11.60.80: Flags [P.], seq 2922585220:2922585505, ack 753872718, win 4085, length 285
18:05:02.928952 IP 117.21.173.120.1291 > 42.51.7.71.3389: Flags [.], ack 4132722021, win 65535, length 0
18:05:02.928954 IP 123.138.17.197.7628 > 42.51.11.160.80: Flags [.], ack 3811, win 1020, length 0
18:05:02.928959 IP 42.236.167.4.7238 > 42.51.11.89.80: Flags [P.], seq 1339503823:1339504493, ack 366175941, win 32768, length 670
18:05:02.929039 IP 119.38.139.142 > 42.51.13.43: ICMP echo request, id 63087, seq 512, length 76
18:05:02.929044 IP 183.204.131.164.27383 > 42.51.11.89.80: Flags [.], ack 698129182, win 32768, length 0
18:05:02.929114 IP 110.188.226.204.57887 > 42.51.26.71.80: Flags [P.], seq 1080760780:1080761590, ack 509259493, win 65079, length 810
18:05:02.929120 IP 120.52.18.60.17267 > 42.51.15.3.80: Flags [.], ack 3478707558, win 72, length 0
18:05:02.929158 IP 106.38.217.93.9032 > 42.51.11.89.80: Flags [P.], seq 2747732216:2747733521, ack 2777239918, win 16409, length 1305
18:05:02.929240 IP 218.93.125.114.57352 > 42.51.3.226.80: Flags [.], ack 2920145263, win 46537, options [nop,nop,sack 1 {1361:4081}], length 0
18:05:02.929245 IP 175.25.172.82.4341 > 42.51.11.100.80: Flags [.], ack 2809534617, win 63819, length 0
18:05:02.929249 IP 218.93.125.114.57352 > 42.51.3.226.80: Flags [.], ack 1, win 46537, options [nop,nop,sack 1 {1361:5441}], length 0
18:05:02.929254 IP 218.93.125.114.57352 > 42.51.3.226.80: Flags [.], ack 1, win 46537, options [nop,nop,sack 1 {1361:6801}], length 0
18:05:02.929258 IP 112.195.127.87.59801 > 42.51.11.160.80: Flags [.], ack 3286426918, win 4633, options [nop,nop,TS val 224281566 ecr 830701981], length 0
18:05:02.929263 IP 113.230.90.233.57741 > 42.51.11.80.80: Flags [.], ack 515331126, win 15708, options [nop,nop,TS val 3655585 ecr 893302701], length 0
18:05:02.929288 IP 111.127.49.17.4914 > 42.51.129.73.80: Flags [S], seq 2396202922, win 65535, options [mss 1440,sackOK,TS val 2827416 ecr 0,nop,wscale 6], length 0
18:05:02.929294 IP 101.23.156.213.1777 > 42.51.11.80.80: Flags [R], seq 1907706459, win 0, length 0
18:05:02.929297 IP 101.23.156.213.1777 > 42.51.11.80.80: Flags [R], seq 1907706459, win 0, length 0
18:05:02.929338 IP 110.188.226.204.57889 > 42.51.26.71.80: Flags [P.], seq 3265147868:3265148671, ack 3140569693, win 65079, length 803
18:05:02.929345 IP 182.140.227.17.29530 > 42.51.7.145.80: Flags [.], ack 704056595, win 1538, length 0
18:05:02.929350 IP 139.214.253.106.23733 > 42.51.145.115.80: Flags [.], ack 309926570, win 197, options [nop,nop,TS val 9931806 ecr 0], length 0
18:05:02.929458 IP 113.4.17.128.4308 > 42.51.11.89.80: Flags [P.], seq 2176062068:2176062976, ack 2286600648, win 32632, length 908
18:05:02.929532 IP 61.158.133.26.56339 > 103.22.191.5.80: Flags [P.], seq 61596676:61597638, ack 1151564592, win 501, length 962
18:05:02.929539 IP 120.52.18.60.17267 > 42.51.15.3.80: Flags [.], ack 1371, win 77, length 0
18:05:02.929543 IP 120.52.18.60.17267 > 42.51.15.3.80: Flags [.], ack 2049, win 83, length 0
18:05:02.929642 IP 58.16.221.146.15550 > 42.51.11.89.80: Flags [P.], seq 323048295:323049476, ack 3306308763, win 16560, length 1181
18:05:02.929649 IP 124.112.116.47.37858 > 103.22.189.11.80: Flags [.], ack 2205398604, win 32768, length 0
18:05:02.929654 IP 124.112.116.47.37857 > 103.22.189.11.80: Flags [.], ack 2926810468, win 32768, length 0
18:05:02.929657 IP 171.217.86.75.49286 > 42.51.11.60.80: Flags [P.], seq 1800351359:1800351699, ack 4290520431, win 16633, length 340
18:05:02.929662 IP 60.222.122.238.3724 > 42.51.11.160.80: Flags [.], ack 1138701282, win 25200, length 0
18:05:02.929665 IP 121.25.229.166.5948 > 42.51.11.80.80: Flags [.], ack 595593435, win 64240, length 0
18:05:02.929711 IP 112.4.172.230.2378 > 103.22.191.145.3389: Flags [P.], seq 2741906488:2741906874, ack 1661010418, win 65524, length 386
18:05:02.929714 IP 120.52.18.56.2824 > 42.51.15.3.80: Flags [S], seq 4252398615, win 14600, options [mss 1460,nop,nop,sackOK,nop,wscale 9], length 0
18:05:02.929769 IP 125.32.142.196.49570 > 42.51.129.73.80: Flags [.], ack 2944056769, win 229, options [nop,nop,TS val 16626948 ecr 1481570578], length 0
18:05:02.929774 IP 61.142.75.40.7866 > 42.51.129.73.80: Flags [S], seq 3088640002, win 29200, options [mss 1452,sackOK,TS val 4038915 ecr 0,nop,wscale 6], length 0
18:05:02.929778 IP 119.246.149.3.60149 > 42.51.129.73.80: Flags [.], ack 678442946, win 229, options [nop,nop,TS val 639024 ecr 1481570473], length 0
18:05:02.929784 IP 106.8.237.92.1668 > 42.51.0.209.80: Flags [.], ack 4212403737, win 65535, length 0
18:05:02.929787 IP 39.85.54.107.61143 > 42.51.11.160.80: Flags [.], ack 1845936400, win 65520, length 0
18:05:02.929819 IP 121.28.34.68.8188 > 42.51.11.109.80: Flags [.], ack 2449769675, win 32768, length 0
18:05:02.929825 IP 115.159.22.140.55639 > 42.51.27.2.80: Flags [.], ack 2087469544, win 515, length 0
18:05:02.929829 IP 61.166.241.202.54239 > 103.22.189.237.80: Flags [.], ack 1104117633, win 8101, options [nop,nop,TS val 151422096 ecr 7924642], length 0
18:05:02.929834 IP 182.140.227.17.29530 > 42.51.7.145.80: Flags [.], ack 1073, win 1538, length 0
18:05:02.929838 IP 182.140.227.17.29530 > 42.51.7.145.80: Flags [.], ack 2145, win 1538, length 0
18:05:02.929843 IP 222.168.251.113.4116 > 42.51.4.151.80: Flags [.], ack 1590493349, win 65535, length 0
18:05:02.929921 IP 1.80.125.60.21908 > 42.51.11.100.80: Flags [.], ack 3517616990, win 265, options [nop,nop,TS val 10052702 ecr 3956779134], length 0
18:05:02.930000 IP 112.195.127.87.59803 > 42.51.11.160.80: Flags [.], ack 3243389950, win 7961, options [nop,nop,TS val 224281567 ecr 830701981], length 0
18:05:02.930058 IP 1.82.149.83.12743 > 42.51.11.60.80: Flags [.], ack 1182404192, win 16560, length 0
18:05:02.930100 IP 182.140.227.17.29530 > 42.51.7.145.80: Flags [.], ack 3217, win 1538, length 0
18:05:02.930106 IP 124.112.116.47.37859 > 103.22.189.11.80: Flags [.], ack 2696372138, win 32768, length 0
18:05:02.930111 IP 61.54.46.63.15900 > 42.51.10.164.80: Flags [S], seq 924582169, win 29200, options [mss 1460,nop,nop,sackOK,nop,wscale 10], length 0
18:05:02.930114 IP 58.100.11.247.13123 > 42.51.11.100.80: Flags [.], ack 2792387927, win 16523, length 0
18:05:02.930119 IP 120.15.6.166.26673 > 42.51.11.80.80: Flags [P.], seq 607612547:607612964, ack 2513289160, win 32768, length 417
18:05:02.930125 IP 120.52.18.60.17267 > 42.51.15.3.80: Flags [.], ack 3419, win 88, length 0
18:05:02.930129 IP 120.52.18.60.17267 > 42.51.15.3.80: Flags [.], ack 4097, win 93, length 0
18:05:02.930134 IP 120.52.18.60.17267 > 42.51.15.3.80: Flags [.], ack 5467, win 99, length 0
18:05:02.930137 IP 120.52.18.60.17267 > 42.51.15.3.80: Flags [.], ack 6145, win 104, length 0
18:05:02.930144 IP 182.122.129.223.4076 > 42.51.11.109.80: Flags [S], seq 3265182064, win 64240, options [mss 1440,nop,nop,sackOK], length 0
18:05:02.930148 IP 124.42.192.37.60292 > 42.51.129.73.80: Flags [.], ack 4128475422, win 123, options [nop,nop,TS val 8525534 ecr 1481570529], length 0
18:05:02.930152 IP 123.126.113.80.61297 > 42.51.8.181.80: Flags [S], seq 2088239917, win 14600, options [mss 1460], length 0
18:05:02.930157 IP 58.23.131.224.61027 > 42.51.11.100.80: Flags [.], ack 1054272030, win 255, length 0
18:05:02.930218 IP 221.206.170.214.50766 > 42.51.11.160.80: Flags [P.], seq 1383894680:1383896351, ack 3976204639, win 8192, length 1671
18:05:02.930226 IP 39.85.54.107.61143 > 42.51.11.160.80: Flags [.], ack 2881, win 65520, length 0
18:05:02.930229 IP 61.166.241.202.54239 > 103.22.189.237.80: Flags [.], ack 1449, win 8192, options [nop,nop,TS val 151422096 ecr 7924643], length 0
18:05:02.930234 IP 123.150.205.222.53566 > 42.51.11.89.80: Flags [.], ack 3198943420, win 16560, options [nop,nop,sack 1 {4294965857:1}], length 0
18:05:02.930237 IP 110.251.245.88.3411 > 42.51.11.80.80: Flags [.], ack 1, win 32768, options [nop,nop,sack 3 {22101:46801}{1301:9101}{1301:9101}], length 0
18:05:02.930331 IP 101.254.19.116.50993 > 42.51.25.90.80: Flags [.], seq 178606792:178606793, ack 2668490784, win 258, length 1
18:05:02.930395 IP 121.28.34.68.8188 > 42.51.11.109.80: Flags [P.], seq 0:410, ack 1, win 32768, length 410
18:05:05.018782 IP 124.234.116.215.20942 > 42.51.129.73.80: Flags [.], ack 3385518658, win 473, options [nop,nop,TS val 853526 ecr 1481572656], length 0
18:05:05.018789 IP 115.51.233.150.30615 > 42.51.11.100.80: Flags [.], ack 46195652, win 450, length 0
18:05:05.018792 IP 180.153.206.16.59151 > 103.22.191.41.80: Flags [.], ack 2603943945, win 46, options [nop,nop,TS val 96743773 ecr 178361494], length 0
18:05:05.018881 IP 220.202.128.60.25421 > 42.51.26.67.80: Flags [.], ack 586601623, win 8192, options [nop,nop,TS val 480468321 ecr 3573634542], length 0
18:05:05.018884 IP 218.64.59.231.49723 > 42.51.10.106.80: Flags [.], ack 1236041069, win 64028, length 0
18:05:05.018937 IP 171.116.240.77.3528 > 42.51.11.80.80: Flags [.], ack 2717797026, win 32768, length 0
18:05:05.019022 IP 60.21.255.228.2263 > 42.51.11.80.80: Flags [.], ack 1112583706, win 32768, length 0
18:05:05.019136 IP 61.167.222.43.1789 > 42.51.11.80.80: Flags [.], ack 1084408738, win 32768, length 0
18:05:05.019139 IP 221.213.104.227.60449 > 42.51.145.122.80: Flags [.], ack 4090746277, win 8181, options [nop,nop,TS val 4552446 ecr 142551567], length 0
18:05:05.019142 IP 171.221.26.135.29420 > 42.51.11.100.80: Flags [.], ack 1406001272, win 16422, length 0
18:05:05.019195 IP 60.55.38.3.10089 > 42.51.14.46.80: Flags [.], ack 2201003070, win 126, length 0
18:05:05.019198 IP 125.58.150.170.64247 > 42.51.11.80.80: Flags [.], ack 3284032281, win 2919, length 0
18:05:05.019201 IP 182.115.128.158.2196 > 42.51.11.109.80: Flags [.], ack 1905680857, win 32768, length 0
18:05:05.019205 IP 124.234.112.35.22986 > 42.51.11.100.80: Flags [.], ack 2813056124, win 9872, length 0
18:05:05.019257 IP 122.142.30.13.1718 > 42.51.11.80.80: Flags [R], seq 361200897, win 0, length 0
18:05:05.019260 IP 113.107.71.114 > 42.51.12.14: ICMP echo reply, id 512, seq 23216, length 40
18:05:05.019414 IP 125.66.115.102.9767 > 42.51.10.151.80: Flags [.], ack 208093786, win 655, options [nop,nop,TS val 1800330 ecr 30789562], length 0
18:05:05.019418 IP 123.138.17.197.7628 > 42.51.11.160.80: Flags [.], ack 571117007, win 1024, length 0
18:05:05.019421 IP 123.138.17.197.7628 > 42.51.11.160.80: Flags [.], ack 1441, win 1024, length 0
18:05:05.019424 IP 175.18.31.56.4232 > 42.51.11.80.80: Flags [.], ack 355073432, win 32316, length 0
18:05:05.019427 IP 113.195.162.138.56141 > 42.51.16.10.3389: Flags [.], ack 156676099, win 64390, length 0
18:05:05.019517 IP 113.140.66.226.49647 > 42.51.11.100.80: Flags [.], ack 1126871508, win 64240, length 0
18:05:05.019520 IP 36.225.34.217.56246 > 42.51.129.73.80: Flags [S], seq 3709124543, win 65535, options [mss 1460,nop,wscale 6,sackOK,TS val 1528490290 ecr 0], length 0
18:05:05.019524 IP 116.114.85.190.54440 > 42.51.11.80.80: Flags [.], ack 1192505297, win 901, length 0
18:05:05.019594 IP 116.211.123.196.14827 > 42.51.10.106.80: Flags [.], ack 4290635226, win 512, length 0
18:05:05.019598 IP 116.211.123.196.14827 > 42.51.10.106.80: Flags [P.], seq 0:117, ack 1, win 512, length 117
18:05:05.019720 IP 42.233.125.178.1732 > 42.51.11.100.80: Flags [.], ack 3883492060, win 65535, length 0
18:05:05.019724 IP 113.84.248.56.11027 > 42.51.26.98.80: Flags [.], ack 2351312994, win 851, options [nop,nop,TS val 2581767 ecr 14873687,nop,nop,sack 1 {1429:7141}], length 0
18:05:05.019727 IP 125.88.189.11.4651 > 42.51.5.82.80: Flags [.], ack 2014393813, win 365, length 0
18:05:05.019734 IP 1.56.212.129.27775 > 42.51.11.109.80: Flags [P.], seq 2740660655:2740663190, ack 3187685603, win 32623, length 2535
18:05:05.019741 IP 122.142.30.13.1718 > 42.51.11.80.80: Flags [R], seq 361200897, win 0, length 0
18:05:05.019744 IP 122.142.30.13.1718 > 42.51.11.80.80: Flags [R], seq 361200897, win 0, length 0
18:05:05.019748 IP 122.142.30.13.1718 > 42.51.11.80.80: Flags [R], seq 361200897, win 0, length 0
18:05:05.019751 IP 123.9.102.57.27517 > 42.51.5.218.80: Flags [.], ack 3639980188, win 16698, options [nop,nop,sack 2 {20329:31945}{1453:18877}], length 0
18:05:05.019754 IP 122.142.30.13.1718 > 42.51.11.80.80: Flags [R], seq 361200897, win 0, length 0
18:05:05.019757 IP 122.142.30.13.1718 > 42.51.11.80.80: Flags [R], seq 361200897, win 0, length 0
18:05:05.019760 IP 42.233.125.178.1732 > 42.51.11.100.80: Flags [.], ack 2572, win 65535, length 0
18:05:05.019782 IP 124.224.81.219.64504 > 42.51.11.60.80: Flags [.], ack 260260110, win 8192, length 0
18:05:05.019832 IP 117.21.173.120.4923 > 42.51.7.23.3389: Flags [.], ack 3809143759, win 65535, length 0
18:05:05.019965 IP 221.225.223.56.12377 > 42.51.129.73.80: Flags [.], ack 3586454081, win 123, options [nop,nop,TS val 2819655 ecr 1481572688], length 0
18:05:05.019973 IP 221.225.223.56.12378 > 42.51.129.73.80: Flags [.], ack 2722199804, win 123, options [nop,nop,TS val 2819655 ecr 1481572688], length 0
18:05:05.019977 IP 116.114.85.190.54440 > 42.51.11.80.80: Flags [.], ack 4511, win 901, length 0
18:05:05.019981 IP 117.21.173.120.1978 > 42.51.15.23.3389: Flags [.], ack 1819962727, win 65535, length 0
18:05:05.019984 IP 117.40.252.139.43294 > 42.51.10.106.80: Flags [.], ack 157521684, win 16372, length 0
18:05:05.020044 IP 175.167.128.61.53553 > 103.22.191.34.80: Flags [.], ack 2708968841, win 429, length 0
18:05:05.020049 IP 123.205.88.18.55920 > 42.51.129.73.80: Flags [S], seq 3495373612, win 5840, options [mss 1460,sackOK,TS val 49743702 ecr 0,nop,wscale 3], length 0
18:05:05.020054 IP 111.175.162.219.51560 > 42.51.11.160.80: Flags [.], ack 3311602024, win 64800, length 0
18:05:05.020059 IP 117.135.227.66.13139 > 42.51.129.73.80: Flags [.], ack 154087355, win 245, options [nop,nop,TS val 6585106 ecr 1481572651], length 0
18:05:05.020145 IP 115.51.233.150.30615 > 42.51.11.100.80: Flags [.], ack 2881, win 472, length 0
18:05:05.020152 IP 118.112.86.80.53759 > 42.51.129.73.80: Flags [.], ack 4291645720, win 473, options [nop,nop,TS val 7384264 ecr 1481572621], length 0
18:05:05.020258 IP 122.142.30.13.1718 > 42.51.11.80.80: Flags [R], seq 361200897, win 0, length 0
18:05:05.020265 IP 122.142.30.13.1718 > 42.51.11.80.80: Flags [R], seq 361200897, win 0, length 0
18:05:05.020269 IP 122.142.30.13.1718 > 42.51.11.80.80: Flags [R], seq 361200897, win 0, length 0
18:05:05.020274 IP 122.142.30.13.1718 > 42.51.11.80.80: Flags [R], seq 361200897, win 0, length 0
18:05:05.020278 IP 125.94.198.246.36570 > 42.51.129.73.80: Flags [S], seq 3142106982, win 14600, options [mss 1402,sackOK,TS val 833742 ecr 0,nop,wscale 7], length 0
18:05:05.020283 IP 171.215.44.28.26552 > 42.51.11.60.80: Flags [.], ack 352947872, win 259, length 0
18:05:05.020287 IP 114.224.51.198.5242 > 42.51.26.70.80: Flags [P.], seq 3497785086:3497785969, ack 2759868567, win 64769, length 883
18:05:05.020308 IP 58.100.0.49.14170 > 42.51.11.100.80: Flags [.], ack 3269016378, win 16612, options [nop,nop,sack 1 {13069:15973}], length 0
18:05:05.020402 IP 119.119.167.235.61299 > 42.51.11.160.80: Flags [P.], seq 2681774913:2681775907, ack 2697295174, win 16274, length 994
18:05:05.020411 IP 117.136.14.73.35650 > 42.51.16.218.80: Flags [.], ack 1251003223, win 1437, length 0
18:05:05.020415 IP 58.34.124.86.60854 > 42.51.129.73.80: Flags [S], seq 251880657, win 14600, options [mss 1412,sackOK,TS val 14415351 ecr 0,nop,wscale 7], length 0
18:05:05.020515 IP 136.243.36.94.40464 > 42.51.26.101.80: Flags [.], ack 2263367566, win 123, options [nop,nop,TS val 133341397 ecr 728859823], length 0
18:05:05.020522 IP 36.250.66.177.39964 > 42.51.129.73.80: Flags [.], ack 2800888344, win 1386, options [nop,nop,TS val 4384193 ecr 1481572616], length 0
18:05:05.020527 IP 58.20.164.210.50919 > 42.51.15.137.80: Flags [.], ack 3095994696, win 65520, length 0
18:05:05.020532 IP 219.79.128.116.42908 > 42.51.129.73.80: Flags [S], seq 3800615309, win 14600, options [mss 1440,sackOK,TS val 46642969 ecr 0,nop,wscale 6], length 0
18:05:05.020536 IP 61.136.81.74.1239 > 42.51.10.106.80: Flags [.], ack 3856908154, win 65535, length 0
18:05:05.020627 IP 110.89.8.46.60513 > 42.51.7.55.80: Flags [.], ack 487099731, win 16560, length 0
18:05:05.020634 IP 110.89.8.46.60513 > 42.51.7.55.80: Flags [.], ack 4097, win 16560, length 0
18:05:05.020638 IP 110.89.8.46.60513 > 42.51.7.55.80: Flags [.], ack 6145, win 16560, length 0
18:05:05.020643 IP 110.89.8.46.60513 > 42.51.7.55.80: Flags [.], ack 8193, win 16560, length 0
18:05:05.020647 IP 60.27.30.6.38422 > 42.51.129.73.80: Flags [.], ack 2829275868, win 4097, options [nop,nop,TS val 1102912312 ecr 1481572696], length 0
18:05:05.020652 IP 58.254.168.108.7509 > 42.51.16.150.80: Flags [P.], seq 937254211:937254420, ack 2782939154, win 64611, length 209
18:05:05.020658 IP 117.158.142.188.1767 > 42.51.1.21.80: Flags [.], ack 4015062966, win 4149, length 0
18:05:05.020663 IP 43.224.213.147.1569 > 42.51.11.80.80: Flags [P.], seq 3366208826:3366209395, ack 3611751761, win 32768, length 569
18:05:05.020669 IP 60.222.122.238.3724 > 42.51.11.160.80: Flags [.], ack 1139524762, win 29160, length 0
18:05:05.020728 IP 42.63.115.134.3802 > 42.51.11.89.80: Flags [.], ack 1867300967, win 46537, length 0
18:05:05.020734 IP 61.136.81.74.20022 > 42.51.10.106.80: Flags [S], seq 3937340730, win 65535, options [mss 1440,nop,nop,sackOK], length 0
18:05:05.020738 IP 117.21.173.120.2250 > 42.51.148.164.3389: Flags [P.], seq 1787691431:1787691817, ack 2985264911, win 65524, length 386
18:05:05.020741 IP 61.136.81.74.1239 > 42.51.10.106.80: Flags [R], seq 3937340731, win 1500, length 0
18:05:05.020746 IP 122.142.30.13.1718 > 42.51.11.80.80: Flags [R], seq 361200897, win 0, length 0
18:05:05.020750 IP 122.142.30.13.1718 > 42.51.11.80.80: Flags [R], seq 361200897, win 0, length 0
18:05:05.020754 IP 122.142.30.13.1718 > 42.51.11.80.80: Flags [R], seq 361200897, win 0, length 0
18:05:05.020759 IP 122.142.30.13.1718 > 42.51.11.80.80: Flags [R], seq 361200897, win 0, length 0
18:05:05.020764 IP 125.230.0.247.53999 > 42.51.129.73.80: Flags [.], ack 56816887, win 245, options [nop,nop,TS val 7641804 ecr 1481572578,nop,nop,sack 1 {4294967152:1}], length 0
18:05:05.020828 IP 61.167.222.43.1789 > 42.51.11.80.80: Flags [.], ack 2881, win 32768, length 0
18:05:05.020903 IP 220.202.128.60.25417 > 42.51.26.67.80: Flags [.], ack 510021988, win 8192, options [nop,nop,TS val 480468325 ecr 3573634720], length 0
18:05:05.020910 IP 101.93.77.99.55076 > 42.51.11.60.80: Flags [.], ack 3343864083, win 260, length 0
18:05:05.020989 IP 182.119.195.12.62104 > 42.51.129.69.80: Flags [.], ack 3142523796, win 16450, length 0
18:05:05.021115 IP 60.55.38.3.10080 > 42.51.14.46.80: Flags [.], ack 188318794, win 564, length 0
18:05:05.021121 IP 202.85.215.157.45912 > 42.51.10.71.22: Flags [.], ack 2330310796, win 115, options [nop,nop,TS val 2157781221 ecr 2301458205], length 0
18:05:05.021181 IP 123.125.71.20.14347 > 42.51.25.125.80: Flags [.], ack 2929940417, win 1316, options [nop,nop,sack 1 {2049:3509}], length 0
18:05:05.021190 IP 121.35.131.39.43067 > 42.51.11.60.80: Flags [P.], seq 724153057:724154711, ack 2638070921, win 16258, length 1654
18:05:05.021199 IP 202.85.215.157.45912 > 42.51.10.71.22: Flags [P.], seq 0:20, ack 1, win 115, options [nop,nop,TS val 2157781221 ecr 2301458205], length 20
18:05:05.021202 IP 219.145.108.14.2256 > 42.51.11.100.80: Flags [.], ack 280240810, win 65535, length 0
18:05:05.021207 IP 58.20.164.211.2855 > 42.51.16.16.80: Flags [.], ack 1339102277, win 32768, length 0
18:05:05.021213 IP 222.93.27.147.6974 > 42.51.4.17.80: Flags [.], seq 3947942738:3947944178, ack 128530580, win 258, length 1440
18:05:05.021230 IP 115.56.217.34.56916 > 42.51.129.73.80: Flags [.], ack 1258985477, win 115, options [nop,nop,TS val 82607760 ecr 1481572712], length 0
18:05:05.021275 IP 49.87.23.173.4793 > 42.51.4.77.80: Flags [S], seq 471708807, win 65535, options [mss 1440,nop,wscale 1,nop,nop,sackOK], length 0
18:05:05.021281 IP 218.83.20.106.36374 > 42.51.16.132.80: Flags [.], ack 3002175422, win 815, options [nop,nop,TS val 3482949 ecr 17407198], length 0
18:05:05.021285 IP 58.59.192.196.56226 > 42.51.11.60.80: Flags [.], seq 3643066547:3643067947, ack 1936010535, win 32288, length 1400
18:05:07.320067 IP 36.56.5.241.1305 > 42.51.16.15.80: Flags [.], ack 2861090656, win 32768, length 0
18:05:07.320071 IP 223.104.12.198.38591 > 42.51.5.95.80: Flags [F.], seq 1881234178, ack 3832414567, win 330, options [nop,nop,TS val 4235736 ecr 178558821], length 0
18:05:07.320075 IP 124.67.20.159.10175 > 42.51.11.160.80: Flags [.], ack 2877850687, win 4263, options [nop,nop,TS val 553271716 ecr 830702432], length 0
18:05:07.320078 IP 222.160.158.254.50624 > 42.51.11.160.80: Flags [.], ack 227164801, win 256, length 0
18:05:07.320082 IP 119.188.91.154.37563 > 42.51.11.160.80: Flags [.], ack 3903718560, win 137, options [nop,nop,TS val 1832472428 ecr 830702438], length 0
18:05:07.320085 IP 119.188.91.154.37563 > 42.51.11.160.80: Flags [.], ack 1449, win 160, options [nop,nop,TS val 1832472428 ecr 830702438], length 0
18:05:07.320088 IP 121.206.98.121.11254 > 42.51.129.73.80: Flags [S], seq 4098258641, win 65535, options [mss 1440,sackOK,TS val 2985600 ecr 0,nop,wscale 8], length 0
18:05:07.320112 IP 180.119.175.229.64747 > 42.51.11.60.80: Flags [.], ack 393499771, win 16497, length 0
18:05:07.320183 IP 116.113.70.140.26673 > 42.51.11.80.80: Flags [S], seq 3313212909, win 8192, options [mss 1452,nop,wscale 2,nop,nop,sackOK], length 0
18:05:07.320187 IP 202.85.215.157.42739 > 42.51.16.58.22: Flags [.], ack 2362029843, win 115, options [nop,nop,TS val 2157783519 ecr 1537344963], length 0
18:05:07.320190 IP 61.167.139.165.3872 > 42.51.10.106.80: Flags [S], seq 1109556650, win 65535, options [mss 1460,nop,nop,sackOK], length 0
18:05:07.320243 IP 122.96.42.197.45505 > 42.51.9.76.80: Flags [S], seq 3006880029, win 27400, options [mss 1370,sackOK,TS val 12465573 ecr 0,nop,wscale 5], length 0
18:05:07.320247 IP 115.213.75.67.10634 > 42.51.26.100.80: Flags [.], ack 311313696, win 581, options [nop,nop,TS val 66347743 ecr 30466761], length 0
18:05:07.320251 IP 115.213.75.67.10634 > 42.51.26.100.80: Flags [.], ack 525, win 590, options [nop,nop,TS val 66347743 ecr 30466761], length 0
18:05:07.320255 IP 106.39.222.40.26160 > 42.51.10.151.80: Flags [S], seq 1670897829, win 13600, options [mss 1360,sackOK,TS val 4359637 ecr 0,nop,wscale 6], length 0
18:05:07.320365 IP 124.234.112.35.22986 > 42.51.11.100.80: Flags [.], ack 2813812124, win 14334, length 0
18:05:07.320370 IP 220.132.180.206.43867 > 42.51.129.73.80: Flags [.], ack 2770664113, win 245, options [nop,nop,TS val 17722753 ecr 1481571932], length 0
